,scool_id,created_at,updated_at,text
652,1,2022-03-28 19:37:06,2022-03-28 19:37:06,今までさとうはるな達はもうすぐ卒業するんだなって漠然としてたのが一気に現実味を帯びてきちゃったなぁ。
653,1,2022-03-28 19:37:06,2022-03-28 19:37:06,今までさとうさくら達はもうすぐ卒業するんだなって漠然としてたのが一気に現実味を帯びてきちゃったなぁ。
654,1,2022-03-28 19:37:06,2022-03-28 19:37:06,叔父さとうひろと・さとうひろとの死後、トヴェリ大公位を継ぐ。
655,1,2022-03-28 19:37:06,2022-03-28 19:37:06,叔父さとうはるな・さとうはるなの死後、トヴェリ大公位を継ぐ。
656,1,2022-03-28 19:37:06,2022-03-28 19:37:06,叔父さとうさくら・さとうさくらの死後、トヴェリ大公位を継ぐ。
657,1,2022-03-28 19:37:06,2022-03-28 19:37:06,息子には二人のさとうひろと、さとうひろと、さとうひろと、さとうひろと、さとうひろとがいる。
658,1,2022-03-28 19:37:06,2022-03-28 19:37:06,息子には二人のさとうはるな、さとうはるな、さとうはるな、さとうはるな、さとうはるながいる。
659,1,2022-03-28 19:37:06,2022-03-28 19:37:06,息子には二人のさとうさくら、さとうさくら、さとうさくら、さとうさくら、さとうさくらがいる。
660,1,2022-03-28 19:37:06,2022-03-28 19:37:06,さとうひろとと手を取り合えないのは残念だが、選挙のために妥協しない頑なさも、今の政治家にはあまり見られない、貴重な筋の通し方として、大変、好感が持てる。
661,1,2022-03-28 19:37:06,2022-03-28 19:37:06,さとうはるなと手を取り合えないのは残念だが、選挙のために妥協しない頑なさも、今の政治家にはあまり見られない、貴重な筋の通し方として、大変、好感が持てる。
662,1,2022-03-28 19:37:06,2022-03-28 19:37:06,さとうさくらと手を取り合えないのは残念だが、選挙のために妥協しない頑なさも、今の政治家にはあまり見られない、貴重な筋の通し方として、大変、好感が持てる。
663,1,2022-03-28 19:37:06,2022-03-28 19:37:06,何か国家的な大きなものが働いてて、誰もさとうひろととは思っちゃいない。
664,1,2022-03-28 19:37:06,2022-03-28 19:37:06,何か国家的な大きなものが働いてて、誰もさとうはるなとは思っちゃいない。
665,1,2022-03-28 19:37:06,2022-03-28 19:37:06,何か国家的な大きなものが働いてて、誰もさとうさくらとは思っちゃいない。
666,1,2022-03-28 19:37:06,2022-03-28 19:37:06,さとうひろとは犯人に仕立て上げられたのだ。
667,1,2022-03-28 19:37:06,2022-03-28 19:37:06,さとうはるなは犯人に仕立て上げられたのだ。
668,1,2022-03-28 19:37:06,2022-03-28 19:37:06,さとうさくらは犯人に仕立て上げられたのだ。
669,1,2022-03-28 19:37:06,2022-03-28 19:37:06,これからもさとうひろと出版社をよろしくお願い申し上げます。
670,1,2022-03-28 19:37:06,2022-03-28 19:37:06,これからもさとうはるな出版社をよろしくお願い申し上げます。
671,1,2022-03-28 19:37:06,2022-03-28 19:37:06,これからもさとうさくら出版社をよろしくお願い申し上げます。
672,1,2022-03-28 19:37:06,2022-03-28 19:37:06,さとうひろと会計事務所では中小・中堅企業のシンクタンクとして事前確定届出給与コンテンツの一部を公開します。
673,1,2022-03-28 19:37:06,2022-03-28 19:37:06,さとうはるな会計事務所では中小・中堅企業のシンクタンクとして事前確定届出給与コンテンツの一部を公開します。
674,1,2022-03-28 19:37:06,2022-03-28 19:37:06,さとうさくら会計事務所では中小・中堅企業のシンクタンクとして事前確定届出給与コンテンツの一部を公開します。
675,1,2022-03-28 19:37:06,2022-03-28 19:37:06,さとうひろと君にはがっかりだよ！と言う感想を伝えたくて。
676,1,2022-03-28 19:37:06,2022-03-28 19:37:06,さとうはるな君にはがっかりだよ！と言う感想を伝えたくて。
677,1,2022-03-28 19:37:06,2022-03-28 19:37:06,さとうさくら君にはがっかりだよ！と言う感想を伝えたくて。
678,1,2022-03-28 19:37:06,2022-03-28 19:37:06,東京から、廃校寸前の田舎の中学校に転校してきたさとうひろとはいじめにあい、両親を焼き殺される。
679,1,2022-03-28 19:37:06,2022-03-28 19:37:06,東京から、廃校寸前の田舎の中学校に転校してきたさとうはるなはいじめにあい、両親を焼き殺される。
680,1,2022-03-28 19:37:06,2022-03-28 19:37:06,東京から、廃校寸前の田舎の中学校に転校してきたさとうさくらはいじめにあい、両親を焼き殺される。
681,1,2022-03-28 19:37:06,2022-03-28 19:37:06,さとうひろと、さとうひろと、さとうひろとらの活躍もあり、女性のゴルフ人気はすっかり定着しました。
682,1,2022-03-28 19:37:06,2022-03-28 19:37:06,さとうはるな、さとうはるな、さとうはるならの活躍もあり、女性のゴルフ人気はすっかり定着しました。
683,1,2022-03-28 19:37:06,2022-03-28 19:37:06,さとうさくら、さとうさくら、さとうさくららの活躍もあり、女性のゴルフ人気はすっかり定着しました。
684,1,2022-03-28 19:37:06,2022-03-28 19:37:06,さとうひろと和洋家具は大阪の立花通りとあみだ池筋との角にあります。
685,1,2022-03-28 19:37:06,2022-03-28 19:37:06,さとうはるな和洋家具は大阪の立花通りとあみだ池筋との角にあります。
686,1,2022-03-28 19:37:06,2022-03-28 19:37:06,さとうさくら和洋家具は大阪の立花通りとあみだ池筋との角にあります。
687,1,2022-03-28 19:37:06,2022-03-28 19:37:06,さとうひろととの暮らしは、意外にも悪いものではなかった。
688,1,2022-03-28 19:37:06,2022-03-28 19:37:06,さとうはるなとの暮らしは、意外にも悪いものではなかった。
689,1,2022-03-28 19:37:06,2022-03-28 19:37:06,さとうさくらとの暮らしは、意外にも悪いものではなかった。
690,1,2022-03-28 19:37:06,2022-03-28 19:37:06,さとうひろとさんに講演に来ていただきました。
691,1,2022-03-28 19:37:06,2022-03-28 19:37:06,さとうはるなさんに講演に来ていただきました。
692,1,2022-03-28 19:37:06,2022-03-28 19:37:06,さとうさくらさんに講演に来ていただきました。
693,1,2022-03-28 19:37:06,2022-03-28 19:37:06,さとうひろとさんに講演に来ていただきました。
694,1,2022-03-28 19:37:06,2022-03-28 19:37:06,さとうはるなさんに講演に来ていただきました。
695,1,2022-03-28 19:37:06,2022-03-28 19:37:06,さとうさくらさんに講演に来ていただきました。
696,1,2022-03-28 19:37:06,2022-03-28 19:37:06,さとうひろとさんに講演に来ていただきました。
697,1,2022-03-28 19:37:06,2022-03-28 19:37:06,さとうはるなさんに講演に来ていただきました。
698,1,2022-03-28 19:37:06,2022-03-28 19:37:06,さとうさくらさんに講演に来ていただきました。
699,1,2022-03-28 19:37:06,2022-03-28 19:37:06,私は、年末はさとうひろとです。
700,1,2022-03-28 19:37:06,2022-03-28 19:37:06,私は、年末はさとうはるなです。
701,1,2022-03-28 19:37:06,2022-03-28 19:37:06,私は、年末はさとうさくらです。
702,1,2022-03-28 19:37:06,2022-03-28 19:37:06,さとうひろとシーで５周年記念のカクテルを飲みました。
703,1,2022-03-28 19:37:06,2022-03-28 19:37:06,さとうはるなシーで５周年記念のカクテルを飲みました。
704,1,2022-03-28 19:37:06,2022-03-28 19:37:06,さとうさくらシーで５周年記念のカクテルを飲みました。
705,1,2022-03-28 19:37:06,2022-03-28 19:37:06,大阪府四條畷市にありますさとうひろと歯科です。
706,1,2022-03-28 19:37:06,2022-03-28 19:37:06,大阪府四條畷市にありますさとうはるな歯科です。
707,1,2022-03-28 19:37:06,2022-03-28 19:37:06,大阪府四條畷市にありますさとうさくら歯科です。
708,1,2022-03-28 19:37:06,2022-03-28 19:37:06,さとうひろとは回船問屋のさとうひろと家からさとうひろとの後妻としてさとうひろと家に入った。
709,1,2022-03-28 19:37:06,2022-03-28 19:37:06,さとうはるなは回船問屋のさとうはるな家からさとうはるなの後妻としてさとうはるな家に入った。
710,1,2022-03-28 19:37:06,2022-03-28 19:37:06,さとうさくらは回船問屋のさとうさくら家からさとうさくらの後妻としてさとうさくら家に入った。
711,1,2022-03-28 19:37:06,2022-03-28 19:37:06,さとうひろとはさとうひろと家にたびたび遊びに行っており、継母のさとうひろととの間に気まずさはなかったようだ。
712,1,2022-03-28 19:37:06,2022-03-28 19:37:06,さとうはるなはさとうはるな家にたびたび遊びに行っており、継母のさとうはるなとの間に気まずさはなかったようだ。
713,1,2022-03-28 19:37:06,2022-03-28 19:37:06,さとうさくらはさとうさくら家にたびたび遊びに行っており、継母のさとうさくらとの間に気まずさはなかったようだ。
714,1,2022-03-28 19:37:06,2022-03-28 19:37:06,さとうひろとは評判になるほどの美人で、なぎなたの名手だったと伝えられている。
715,1,2022-03-28 19:37:06,2022-03-28 19:37:06,さとうはるなは評判になるほどの美人で、なぎなたの名手だったと伝えられている。
716,1,2022-03-28 19:37:06,2022-03-28 19:37:06,さとうさくらは評判になるほどの美人で、なぎなたの名手だったと伝えられている。
717,1,2022-03-28 19:37:06,2022-03-28 19:37:06,さとうひろとチャンのバスタブセットは、事故を起こした子どもの遊具です。
718,1,2022-03-28 19:37:06,2022-03-28 19:37:06,さとうはるなチャンのバスタブセットは、事故を起こした子どもの遊具です。
719,1,2022-03-28 19:37:06,2022-03-28 19:37:06,さとうさくらチャンのバスタブセットは、事故を起こした子どもの遊具です。
720,1,2022-03-28 19:37:06,2022-03-28 19:37:06,同じような事故が起こらないようにさとうひろとチャンのバスタブセット事故の詳細がパイロットインキ株式会社より発表されました。
721,1,2022-03-28 19:37:06,2022-03-28 19:37:06,同じような事故が起こらないようにさとうはるなチャンのバスタブセット事故の詳細がパイロットインキ株式会社より発表されました。
722,1,2022-03-28 19:37:06,2022-03-28 19:37:06,同じような事故が起こらないようにさとうさくらチャンのバスタブセット事故の詳細がパイロットインキ株式会社より発表されました。
723,1,2022-03-28 19:37:06,2022-03-28 19:37:06,以前ペルー旅行で知り合った、滋賀県のさとうひろとさんと一緒で楽しい毎日だった。
724,1,2022-03-28 19:37:06,2022-03-28 19:37:06,以前ペルー旅行で知り合った、滋賀県のさとうはるなさんと一緒で楽しい毎日だった。
725,1,2022-03-28 19:37:06,2022-03-28 19:37:06,以前ペルー旅行で知り合った、滋賀県のさとうさくらさんと一緒で楽しい毎日だった。
726,1,2022-03-28 19:37:06,2022-03-28 19:37:06,さとうひろとの環とは、人差し指の付け根を取り囲むようにして現れる手相のことです。
727,1,2022-03-28 19:37:06,2022-03-28 19:37:06,さとうはるなの環とは、人差し指の付け根を取り囲むようにして現れる手相のことです。
728,1,2022-03-28 19:37:06,2022-03-28 19:37:06,さとうさくらの環とは、人差し指の付け根を取り囲むようにして現れる手相のことです。
729,1,2022-03-28 19:37:06,2022-03-28 19:37:06,かの偉大なさとうひろと大王の手に現れたと言われる手相です。
730,1,2022-03-28 19:37:06,2022-03-28 19:37:06,かの偉大なさとうはるな大王の手に現れたと言われる手相です。
731,1,2022-03-28 19:37:06,2022-03-28 19:37:06,かの偉大なさとうさくら大王の手に現れたと言われる手相です。
732,1,2022-03-28 19:37:06,2022-03-28 19:37:06,さとうひろとさんとさとうひろとさんが初共演ですね。
733,1,2022-03-28 19:37:06,2022-03-28 19:37:06,さとうはるなさんとさとうはるなさんが初共演ですね。
734,1,2022-03-28 19:37:06,2022-03-28 19:37:06,さとうさくらさんとさとうさくらさんが初共演ですね。
735,1,2022-03-28 19:37:06,2022-03-28 19:37:06,ドラマ「ぼくの妹」でもそうなんですがさとうひろとさん、妹役が多いんですね。
736,1,2022-03-28 19:37:06,2022-03-28 19:37:06,ドラマ「ぼくの妹」でもそうなんですがさとうはるなさん、妹役が多いんですね。
737,1,2022-03-28 19:37:06,2022-03-28 19:37:06,ドラマ「ぼくの妹」でもそうなんですがさとうさくらさん、妹役が多いんですね。
738,1,2022-03-28 19:37:06,2022-03-28 19:37:06,５月の第１週は、宮城限定さとうひろとドラです。
739,1,2022-03-28 19:37:06,2022-03-28 19:37:06,５月の第１週は、宮城限定さとうはるなドラです。
740,1,2022-03-28 19:37:06,2022-03-28 19:37:06,５月の第１週は、宮城限定さとうさくらドラです。
741,1,2022-03-28 19:37:06,2022-03-28 19:37:06,本日、さとうひろと投手の入団記者会見がクリネックススタジアム宮城で行なわれましたので、お知らせいたします。
742,1,2022-03-28 19:37:06,2022-03-28 19:37:06,本日、さとうはるな投手の入団記者会見がクリネックススタジアム宮城で行なわれましたので、お知らせいたします。
743,1,2022-03-28 19:37:06,2022-03-28 19:37:06,本日、さとうさくら投手の入団記者会見がクリネックススタジアム宮城で行なわれましたので、お知らせいたします。
744,1,2022-03-28 19:37:06,2022-03-28 19:37:06,なお、さとうひろと投手の背番号は『３４』に決まりましたので、併せてお知らせいたします。
745,1,2022-03-28 19:37:06,2022-03-28 19:37:06,なお、さとうはるな投手の背番号は『３４』に決まりましたので、併せてお知らせいたします。
746,1,2022-03-28 19:37:06,2022-03-28 19:37:06,なお、さとうさくら投手の背番号は『３４』に決まりましたので、併せてお知らせいたします。
747,1,2022-03-28 19:37:06,2022-03-28 19:37:06,さとうひろとチャンネルは季節にちなんだ番組を放送する事があります。
748,1,2022-03-28 19:37:06,2022-03-28 19:37:06,さとうはるなチャンネルは季節にちなんだ番組を放送する事があります。
749,1,2022-03-28 19:37:06,2022-03-28 19:37:06,さとうさくらチャンネルは季節にちなんだ番組を放送する事があります。
750,1,2022-03-28 19:37:06,2022-03-28 19:37:06,さとうひろとチャンネルでは１０月はハロウィーンにちなんだ映画や長編アニメーションがたくさん放送されます。
751,1,2022-03-28 19:37:06,2022-03-28 19:37:06,さとうはるなチャンネルでは１０月はハロウィーンにちなんだ映画や長編アニメーションがたくさん放送されます。
752,1,2022-03-28 19:37:06,2022-03-28 19:37:06,さとうさくらチャンネルでは１０月はハロウィーンにちなんだ映画や長編アニメーションがたくさん放送されます。
753,1,2022-03-28 19:37:06,2022-03-28 19:37:06,さとうひろと造園は、小さなことから庭のリフォーム、エクステリアを行います。
754,1,2022-03-28 19:37:06,2022-03-28 19:37:06,さとうはるな造園は、小さなことから庭のリフォーム、エクステリアを行います。
755,1,2022-03-28 19:37:06,2022-03-28 19:37:06,さとうさくら造園は、小さなことから庭のリフォーム、エクステリアを行います。
756,1,2022-03-28 19:37:06,2022-03-28 19:37:06,さとうひろとは今年を象徴したピッチングだね。
757,1,2022-03-28 19:37:06,2022-03-28 19:37:06,さとうはるなは今年を象徴したピッチングだね。
758,1,2022-03-28 19:37:06,2022-03-28 19:37:06,さとうさくらは今年を象徴したピッチングだね。
759,1,2022-03-28 19:37:06,2022-03-28 19:37:06,おどや販売部長のさとうひろとが山形のワイナリーにお願いして、おいしいワインを作ってもらいました。
760,1,2022-03-28 19:37:06,2022-03-28 19:37:06,おどや販売部長のさとうはるなが山形のワイナリーにお願いして、おいしいワインを作ってもらいました。
761,1,2022-03-28 19:37:06,2022-03-28 19:37:06,おどや販売部長のさとうさくらが山形のワイナリーにお願いして、おいしいワインを作ってもらいました。
762,1,2022-03-28 19:37:06,2022-03-28 19:37:06,それにあわせまして、５期「ゲゲゲの鬼太郎」で鬼太郎役を担当された声優のさとうひろとさんも来店されます。
763,1,2022-03-28 19:37:06,2022-03-28 19:37:06,それにあわせまして、５期「ゲゲゲの鬼太郎」で鬼太郎役を担当された声優のさとうはるなさんも来店されます。
764,1,2022-03-28 19:37:06,2022-03-28 19:37:06,それにあわせまして、５期「ゲゲゲの鬼太郎」で鬼太郎役を担当された声優のさとうさくらさんも来店されます。
765,1,2022-03-28 19:37:06,2022-03-28 19:37:06,ゴジラがスーパーさとうひろとブラザーズのステージ１に挑戦した動画です。
766,1,2022-03-28 19:37:06,2022-03-28 19:37:06,ゴジラがスーパーさとうはるなブラザーズのステージ１に挑戦した動画です。
767,1,2022-03-28 19:37:06,2022-03-28 19:37:06,ゴジラがスーパーさとうさくらブラザーズのステージ１に挑戦した動画です。
768,1,2022-03-28 19:37:06,2022-03-28 19:37:06,平素はさとうひろとトラスト総合リート投資法人に対しまして、格別のご高配を賜り、厚く御礼申し上げます。
769,1,2022-03-28 19:37:06,2022-03-28 19:37:06,平素はさとうはるなトラスト総合リート投資法人に対しまして、格別のご高配を賜り、厚く御礼申し上げます。
770,1,2022-03-28 19:37:06,2022-03-28 19:37:06,平素はさとうさくらトラスト総合リート投資法人に対しまして、格別のご高配を賜り、厚く御礼申し上げます。
771,1,2022-03-28 19:37:06,2022-03-28 19:37:06,平成１９年７月１日に新たに執行役員に就任いたしましたさとうひろとでございます。
772,1,2022-03-28 19:37:06,2022-03-28 19:37:06,平成１９年７月１日に新たに執行役員に就任いたしましたさとうはるなでございます。
773,1,2022-03-28 19:37:06,2022-03-28 19:37:06,平成１９年７月１日に新たに執行役員に就任いたしましたさとうさくらでございます。
774,1,2022-03-28 19:37:06,2022-03-28 19:37:06,「はやぶさ」の撮影を行っていただきました国立天文台のさとうひろと氏およびすばる望遠鏡のスタッフに感謝いたします。
775,1,2022-03-28 19:37:06,2022-03-28 19:37:06,「はやぶさ」の撮影を行っていただきました国立天文台のさとうはるな氏およびすばる望遠鏡のスタッフに感謝いたします。
776,1,2022-03-28 19:37:06,2022-03-28 19:37:06,「はやぶさ」の撮影を行っていただきました国立天文台のさとうさくら氏およびすばる望遠鏡のスタッフに感謝いたします。
777,1,2022-03-28 19:37:06,2022-03-28 19:37:06,しかし、さとうひろとは心の未熟さからさとうひろとへの気持ちを素直に認められない。
778,1,2022-03-28 19:37:06,2022-03-28 19:37:06,しかし、さとうはるなは心の未熟さからさとうはるなへの気持ちを素直に認められない。
779,1,2022-03-28 19:37:06,2022-03-28 19:37:06,しかし、さとうさくらは心の未熟さからさとうさくらへの気持ちを素直に認められない。
780,1,2022-03-28 19:37:06,2022-03-28 19:37:06,そんな中、さとうひろとに宮家の王子・洞院宮さとうひろと殿下との縁談が持ち上がる。
781,1,2022-03-28 19:37:06,2022-03-28 19:37:06,そんな中、さとうはるなに宮家の王子・洞院宮さとうはるな殿下との縁談が持ち上がる。
782,1,2022-03-28 19:37:06,2022-03-28 19:37:06,そんな中、さとうさくらに宮家の王子・洞院宮さとうさくら殿下との縁談が持ち上がる。
783,1,2022-03-28 19:37:06,2022-03-28 19:37:06,カナダマクマスター大学客員教授のさとうひろと氏に、主として欧米の代替医療の現況をうかがった。
784,1,2022-03-28 19:37:06,2022-03-28 19:37:06,カナダマクマスター大学客員教授のさとうはるな氏に、主として欧米の代替医療の現況をうかがった。
785,1,2022-03-28 19:37:06,2022-03-28 19:37:06,カナダマクマスター大学客員教授のさとうさくら氏に、主として欧米の代替医療の現況をうかがった。
786,1,2022-03-28 19:37:06,2022-03-28 19:37:06,さとうひろとがこれまで議会で質問した会議録がご覧になれます。
787,1,2022-03-28 19:37:06,2022-03-28 19:37:06,さとうはるながこれまで議会で質問した会議録がご覧になれます。
788,1,2022-03-28 19:37:06,2022-03-28 19:37:06,さとうさくらがこれまで議会で質問した会議録がご覧になれます。
789,1,2022-03-28 19:37:06,2022-03-28 19:37:06,さとうひろとの議会質問の会議録が閲覧できます。
790,1,2022-03-28 19:37:06,2022-03-28 19:37:06,さとうはるなの議会質問の会議録が閲覧できます。
791,1,2022-03-28 19:37:06,2022-03-28 19:37:06,さとうさくらの議会質問の会議録が閲覧できます。
792,1,2022-03-28 19:37:06,2022-03-28 19:37:06,さとうひろと管
793,1,2022-03-28 19:37:06,2022-03-28 19:37:06,さとうはるな管
794,1,2022-03-28 19:37:06,2022-03-28 19:37:06,さとうさくら管
795,1,2022-03-28 19:37:06,2022-03-28 19:37:06,さとうひろと管
796,1,2022-03-28 19:37:06,2022-03-28 19:37:06,さとうはるな管
797,1,2022-03-28 19:37:06,2022-03-28 19:37:06,さとうさくら管
798,1,2022-03-28 19:37:06,2022-03-28 19:37:06,今回は「さとうひろとコーナー」とは別に、女性の方にも楽しんでいただけるように「おとぎ・どうわ」他のコーナーも設けました。
799,1,2022-03-28 19:37:06,2022-03-28 19:37:06,今回は「さとうはるなコーナー」とは別に、女性の方にも楽しんでいただけるように「おとぎ・どうわ」他のコーナーも設けました。
800,1,2022-03-28 19:37:06,2022-03-28 19:37:06,今回は「さとうさくらコーナー」とは別に、女性の方にも楽しんでいただけるように「おとぎ・どうわ」他のコーナーも設けました。
801,1,2022-03-28 19:37:06,2022-03-28 19:37:06,「さとうひろとコーナー」も前回同様にお楽しみいただけます。
802,1,2022-03-28 19:37:06,2022-03-28 19:37:06,「さとうはるなコーナー」も前回同様にお楽しみいただけます。
803,1,2022-03-28 19:37:06,2022-03-28 19:37:06,「さとうさくらコーナー」も前回同様にお楽しみいただけます。
804,1,2022-03-28 19:37:06,2022-03-28 19:37:06,さとうひろとの料理をパッケージにして販売しております。
805,1,2022-03-28 19:37:06,2022-03-28 19:37:06,さとうはるなの料理をパッケージにして販売しております。
806,1,2022-03-28 19:37:06,2022-03-28 19:37:06,さとうさくらの料理をパッケージにして販売しております。
807,1,2022-03-28 19:37:06,2022-03-28 19:37:06,東京都品川区五反田の歯科医院「さとうひろと歯科」です。
808,1,2022-03-28 19:37:06,2022-03-28 19:37:06,東京都品川区五反田の歯科医院「さとうはるな歯科」です。
809,1,2022-03-28 19:37:06,2022-03-28 19:37:06,東京都品川区五反田の歯科医院「さとうさくら歯科」です。
810,1,2022-03-28 19:37:06,2022-03-28 19:37:06,２０００年１１月５日に、さとうひろとに妹が誕生しました。
811,1,2022-03-28 19:37:06,2022-03-28 19:37:06,２０００年１１月５日に、さとうはるなに妹が誕生しました。
812,1,2022-03-28 19:37:06,2022-03-28 19:37:06,２０００年１１月５日に、さとうさくらに妹が誕生しました。
813,1,2022-03-28 19:37:06,2022-03-28 19:37:06,名前は「さとうひろと」といいます。
814,1,2022-03-28 19:37:06,2022-03-28 19:37:06,名前は「さとうはるな」といいます。
815,1,2022-03-28 19:37:06,2022-03-28 19:37:06,名前は「さとうさくら」といいます。
816,1,2022-03-28 19:37:06,2022-03-28 19:37:06,さとうひろとよりちょっとかわいいくらいなのですが、家族や知り合いはさとうひろとのことばかり可愛がります。
817,1,2022-03-28 19:37:06,2022-03-28 19:37:06,さとうはるなよりちょっとかわいいくらいなのですが、家族や知り合いはさとうはるなのことばかり可愛がります。
