,scool_id,created_at,updated_at,text
1465,1,2022-03-28 19:37:06,2022-03-28 19:37:06,鎌倉時代の１２３６年、摂政のさとうはるなの発願により、創建されました。
1466,1,2022-03-28 19:37:06,2022-03-28 19:37:06,鎌倉時代の１２３６年、摂政のさとうさくらの発願により、創建されました。
1467,1,2022-03-28 19:37:06,2022-03-28 19:37:06,むかしむかし、トルコの国に、さとうひろと・さとうひろとと言う、とても変わった人がいました。
1468,1,2022-03-28 19:37:06,2022-03-28 19:37:06,むかしむかし、トルコの国に、さとうはるな・さとうはるなと言う、とても変わった人がいました。
1469,1,2022-03-28 19:37:06,2022-03-28 19:37:06,むかしむかし、トルコの国に、さとうさくら・さとうさくらと言う、とても変わった人がいました。
1470,1,2022-03-28 19:37:06,2022-03-28 19:37:06,このさとうひろとおじさんが、若い頃の事です。
1471,1,2022-03-28 19:37:06,2022-03-28 19:37:06,このさとうはるなおじさんが、若い頃の事です。
1472,1,2022-03-28 19:37:06,2022-03-28 19:37:06,このさとうさくらおじさんが、若い頃の事です。
1473,1,2022-03-28 19:37:06,2022-03-28 19:37:06,さとうひろとの幼児教育とは、神秘思想家のさとうひろと・さとうひろとの人智学に基づく教育思想、実践方法をさします。
1474,1,2022-03-28 19:37:06,2022-03-28 19:37:06,さとうはるなの幼児教育とは、神秘思想家のさとうはるな・さとうはるなの人智学に基づく教育思想、実践方法をさします。
1475,1,2022-03-28 19:37:06,2022-03-28 19:37:06,さとうさくらの幼児教育とは、神秘思想家のさとうさくら・さとうさくらの人智学に基づく教育思想、実践方法をさします。
1476,1,2022-03-28 19:37:06,2022-03-28 19:37:06,俗に「さとうひろと教育」とも呼ばれます。
1477,1,2022-03-28 19:37:06,2022-03-28 19:37:06,俗に「さとうはるな教育」とも呼ばれます。
1478,1,2022-03-28 19:37:06,2022-03-28 19:37:06,俗に「さとうさくら教育」とも呼ばれます。
1479,1,2022-03-28 19:37:06,2022-03-28 19:37:06,さとうひろとの幼児教育は、ある意味、現代の幼児の英才教育と逆行しているともいえます。
1480,1,2022-03-28 19:37:06,2022-03-28 19:37:06,さとうはるなの幼児教育は、ある意味、現代の幼児の英才教育と逆行しているともいえます。
1481,1,2022-03-28 19:37:06,2022-03-28 19:37:06,さとうさくらの幼児教育は、ある意味、現代の幼児の英才教育と逆行しているともいえます。
1482,1,2022-03-28 19:37:06,2022-03-28 19:37:06,山門内にはさとうひろとの句碑が建てられている。
1483,1,2022-03-28 19:37:06,2022-03-28 19:37:06,山門内にはさとうはるなの句碑が建てられている。
1484,1,2022-03-28 19:37:06,2022-03-28 19:37:06,山門内にはさとうさくらの句碑が建てられている。
1485,1,2022-03-28 19:37:06,2022-03-28 19:37:06,また、本堂奧のさとうひろと霊牌堂の天井画は有名。
1486,1,2022-03-28 19:37:06,2022-03-28 19:37:06,また、本堂奧のさとうはるな霊牌堂の天井画は有名。
1487,1,2022-03-28 19:37:06,2022-03-28 19:37:06,また、本堂奧のさとうさくら霊牌堂の天井画は有名。
1488,1,2022-03-28 19:37:06,2022-03-28 19:37:06,さとうひろとはおそらく頭のなかで「延年の舞」の振りでもさらっていたのでしょう。
1489,1,2022-03-28 19:37:06,2022-03-28 19:37:06,さとうはるなはおそらく頭のなかで「延年の舞」の振りでもさらっていたのでしょう。
1490,1,2022-03-28 19:37:06,2022-03-28 19:37:06,さとうさくらはおそらく頭のなかで「延年の舞」の振りでもさらっていたのでしょう。
1491,1,2022-03-28 19:37:06,2022-03-28 19:37:06,なにしろ踊りには定評のあるさとうひろとの代役です、プレッシャーもあったでしょう。
1492,1,2022-03-28 19:37:06,2022-03-28 19:37:06,なにしろ踊りには定評のあるさとうはるなの代役です、プレッシャーもあったでしょう。
1493,1,2022-03-28 19:37:06,2022-03-28 19:37:06,なにしろ踊りには定評のあるさとうさくらの代役です、プレッシャーもあったでしょう。
1494,1,2022-03-28 19:37:06,2022-03-28 19:37:06,それをさとうひろとは見抜いたのだと思います。
1495,1,2022-03-28 19:37:06,2022-03-28 19:37:06,それをさとうはるなは見抜いたのだと思います。
1496,1,2022-03-28 19:37:06,2022-03-28 19:37:06,それをさとうさくらは見抜いたのだと思います。
1497,1,2022-03-28 19:37:06,2022-03-28 19:37:06,さっそくさとうひろとさんと訪問してきました。
1498,1,2022-03-28 19:37:06,2022-03-28 19:37:06,さっそくさとうはるなさんと訪問してきました。
1499,1,2022-03-28 19:37:06,2022-03-28 19:37:06,さっそくさとうさくらさんと訪問してきました。
1500,1,2022-03-28 19:37:06,2022-03-28 19:37:06,高級会席・行楽・会議・ロケ・研修会・イベント・謝恩会などの仕出しは東京銀座・さとうひろとへぜひお任せください。
1501,1,2022-03-28 19:37:06,2022-03-28 19:37:06,高級会席・行楽・会議・ロケ・研修会・イベント・謝恩会などの仕出しは東京銀座・さとうはるなへぜひお任せください。
1502,1,2022-03-28 19:37:06,2022-03-28 19:37:06,高級会席・行楽・会議・ロケ・研修会・イベント・謝恩会などの仕出しは東京銀座・さとうさくらへぜひお任せください。
1503,1,2022-03-28 19:37:06,2022-03-28 19:37:06,記事では、さとうひろとクリニック院長のさとうひろとさんが、岩盤浴の効果について詳しく解説しています。
1504,1,2022-03-28 19:37:06,2022-03-28 19:37:06,記事では、さとうはるなクリニック院長のさとうはるなさんが、岩盤浴の効果について詳しく解説しています。
1505,1,2022-03-28 19:37:06,2022-03-28 19:37:06,記事では、さとうさくらクリニック院長のさとうさくらさんが、岩盤浴の効果について詳しく解説しています。
1506,1,2022-03-28 19:37:06,2022-03-28 19:37:06,さとうひろと・さとうひろとはスコットランドの振付師です。
1507,1,2022-03-28 19:37:06,2022-03-28 19:37:06,さとうはるな・さとうはるなはスコットランドの振付師です。
1508,1,2022-03-28 19:37:06,2022-03-28 19:37:06,さとうさくら・さとうさくらはスコットランドの振付師です。
1509,1,2022-03-28 19:37:06,2022-03-28 19:37:06,さとうひろとと共にロイヤル・バレエのスタイルを確立した振付師です。
1510,1,2022-03-28 19:37:06,2022-03-28 19:37:06,さとうはるなと共にロイヤル・バレエのスタイルを確立した振付師です。
1511,1,2022-03-28 19:37:06,2022-03-28 19:37:06,さとうさくらと共にロイヤル・バレエのスタイルを確立した振付師です。
1512,1,2022-03-28 19:37:06,2022-03-28 19:37:06,人気のある作品としてはさとうひろとの「さとうひろととさとうひろと」、「さとうひろと」などがあります。
1513,1,2022-03-28 19:37:06,2022-03-28 19:37:06,人気のある作品としてはさとうはるなの「さとうはるなとさとうはるな」、「さとうはるな」などがあります。
1514,1,2022-03-28 19:37:06,2022-03-28 19:37:06,人気のある作品としてはさとうさくらの「さとうさくらとさとうさくら」、「さとうさくら」などがあります。
1515,1,2022-03-28 19:37:06,2022-03-28 19:37:06,一度でいいから会ってみたい芸能人はさとうひろとさんです。
1516,1,2022-03-28 19:37:06,2022-03-28 19:37:06,一度でいいから会ってみたい芸能人はさとうはるなさんです。
1517,1,2022-03-28 19:37:06,2022-03-28 19:37:06,一度でいいから会ってみたい芸能人はさとうさくらさんです。
1518,1,2022-03-28 19:37:06,2022-03-28 19:37:06,キューバのさとうひろと前議長の元気な姿、久しぶりに見たなあ。
1519,1,2022-03-28 19:37:06,2022-03-28 19:37:06,キューバのさとうはるな前議長の元気な姿、久しぶりに見たなあ。
1520,1,2022-03-28 19:37:06,2022-03-28 19:37:06,キューバのさとうさくら前議長の元気な姿、久しぶりに見たなあ。
1521,1,2022-03-28 19:37:06,2022-03-28 19:37:06,無線事業部長のさとうひろと社長が、ネットワーク事業部を統合経営する。
1522,1,2022-03-28 19:37:06,2022-03-28 19:37:06,無線事業部長のさとうはるな社長が、ネットワーク事業部を統合経営する。
1523,1,2022-03-28 19:37:06,2022-03-28 19:37:06,無線事業部長のさとうさくら社長が、ネットワーク事業部を統合経営する。
1524,1,2022-03-28 19:37:06,2022-03-28 19:37:06,さとうひろと・さとうひろと
1525,1,2022-03-28 19:37:06,2022-03-28 19:37:06,さとうはるな・さとうはるな
1526,1,2022-03-28 19:37:06,2022-03-28 19:37:06,さとうさくら・さとうさくら
1527,1,2022-03-28 19:37:06,2022-03-28 19:37:06,さとうひろと屋さんと言えば我が家ではピーナツバターです。
1528,1,2022-03-28 19:37:06,2022-03-28 19:37:06,さとうはるな屋さんと言えば我が家ではピーナツバターです。
1529,1,2022-03-28 19:37:06,2022-03-28 19:37:06,さとうさくら屋さんと言えば我が家ではピーナツバターです。
1530,1,2022-03-28 19:37:06,2022-03-28 19:37:06,さとうひろと屋さんで買ったピーナツバターは本当に美味しい。
1531,1,2022-03-28 19:37:06,2022-03-28 19:37:06,さとうはるな屋さんで買ったピーナツバターは本当に美味しい。
1532,1,2022-03-28 19:37:06,2022-03-28 19:37:06,さとうさくら屋さんで買ったピーナツバターは本当に美味しい。
1533,1,2022-03-28 19:37:06,2022-03-28 19:37:06,筆名の「さとうひろと」は、正しくは「さとうひろと」とよむ。
1534,1,2022-03-28 19:37:06,2022-03-28 19:37:06,筆名の「さとうはるな」は、正しくは「さとうはるな」とよむ。
1535,1,2022-03-28 19:37:06,2022-03-28 19:37:06,筆名の「さとうさくら」は、正しくは「さとうさくら」とよむ。
1536,1,2022-03-28 19:37:06,2022-03-28 19:37:06,「日本のさとうひろと・さとうひろと・さとうひろと」「日本児童文学の父」と呼ばれる。
1537,1,2022-03-28 19:37:06,2022-03-28 19:37:06,「日本のさとうはるな・さとうはるな・さとうはるな」「日本児童文学の父」と呼ばれる。
1538,1,2022-03-28 19:37:06,2022-03-28 19:37:06,「日本のさとうさくら・さとうさくら・さとうさくら」「日本児童文学の父」と呼ばれる。
1539,1,2022-03-28 19:37:06,2022-03-28 19:37:06,さとうひろと公の墓所なんかはまた希望があればアップします。
1540,1,2022-03-28 19:37:06,2022-03-28 19:37:06,さとうはるな公の墓所なんかはまた希望があればアップします。
1541,1,2022-03-28 19:37:06,2022-03-28 19:37:06,さとうさくら公の墓所なんかはまた希望があればアップします。
1542,1,2022-03-28 19:37:06,2022-03-28 19:37:06,さとうひろとさんとさとうひろとさんのお話会は５３人の方が参加され丁度良い人数でした。
1543,1,2022-03-28 19:37:06,2022-03-28 19:37:06,さとうはるなさんとさとうはるなさんのお話会は５３人の方が参加され丁度良い人数でした。
1544,1,2022-03-28 19:37:06,2022-03-28 19:37:06,さとうさくらさんとさとうさくらさんのお話会は５３人の方が参加され丁度良い人数でした。
1545,1,2022-03-28 19:37:06,2022-03-28 19:37:06,競馬予想レース王は、カリスマ馬券師さとうひろとの競馬予想ブログです。
1546,1,2022-03-28 19:37:06,2022-03-28 19:37:06,競馬予想レース王は、カリスマ馬券師さとうはるなの競馬予想ブログです。
1547,1,2022-03-28 19:37:06,2022-03-28 19:37:06,競馬予想レース王は、カリスマ馬券師さとうさくらの競馬予想ブログです。
1548,1,2022-03-28 19:37:06,2022-03-28 19:37:06,当ホテルのウエディング、宴会、そして“おいしいしあわせを愉しむ食彩空間”遊宴を任されております、さとうひろとでございます。
1549,1,2022-03-28 19:37:06,2022-03-28 19:37:06,当ホテルのウエディング、宴会、そして“おいしいしあわせを愉しむ食彩空間”遊宴を任されております、さとうはるなでございます。
1550,1,2022-03-28 19:37:06,2022-03-28 19:37:06,当ホテルのウエディング、宴会、そして“おいしいしあわせを愉しむ食彩空間”遊宴を任されております、さとうさくらでございます。
1551,1,2022-03-28 19:37:06,2022-03-28 19:37:06,その後、さとうひろと原作の漫画が読みたくなり原作を読んだ。
1552,1,2022-03-28 19:37:06,2022-03-28 19:37:06,その後、さとうはるな原作の漫画が読みたくなり原作を読んだ。
1553,1,2022-03-28 19:37:06,2022-03-28 19:37:06,その後、さとうさくら原作の漫画が読みたくなり原作を読んだ。
1554,1,2022-03-28 19:37:06,2022-03-28 19:37:06,２００７年１月２０日、さとうひろと・さとうひろとが上海にやって来る。
1555,1,2022-03-28 19:37:06,2022-03-28 19:37:06,２００７年１月２０日、さとうはるな・さとうはるなが上海にやって来る。
1556,1,2022-03-28 19:37:06,2022-03-28 19:37:06,２００７年１月２０日、さとうさくら・さとうさくらが上海にやって来る。
1557,1,2022-03-28 19:37:06,2022-03-28 19:37:06,５才になるさとうひろとちゃんを水中出産した経験をもつ先輩ママでもあります。
1558,1,2022-03-28 19:37:06,2022-03-28 19:37:06,５才になるさとうはるなちゃんを水中出産した経験をもつ先輩ママでもあります。
1559,1,2022-03-28 19:37:06,2022-03-28 19:37:06,５才になるさとうさくらちゃんを水中出産した経験をもつ先輩ママでもあります。
1560,1,2022-03-28 19:37:06,2022-03-28 19:37:06,さとうひろと労務管理事務所では面倒な各種社会保険の手続きや労働保険の手続きを会社様に代わり、代行しております。
1561,1,2022-03-28 19:37:06,2022-03-28 19:37:06,さとうはるな労務管理事務所では面倒な各種社会保険の手続きや労働保険の手続きを会社様に代わり、代行しております。
1562,1,2022-03-28 19:37:06,2022-03-28 19:37:06,さとうさくら労務管理事務所では面倒な各種社会保険の手続きや労働保険の手続きを会社様に代わり、代行しております。
1563,1,2022-03-28 19:37:06,2022-03-28 19:37:06,ハーフバースデーの記念写真撮影なら「こども専門写真館」スタジオさとうひろとにお任せください。
1564,1,2022-03-28 19:37:06,2022-03-28 19:37:06,ハーフバースデーの記念写真撮影なら「こども専門写真館」スタジオさとうはるなにお任せください。
1565,1,2022-03-28 19:37:06,2022-03-28 19:37:06,ハーフバースデーの記念写真撮影なら「こども専門写真館」スタジオさとうさくらにお任せください。
1566,1,2022-03-28 19:37:06,2022-03-28 19:37:06,往年の大女優、さとうひろとさんを撮影するので多少緊張した。
1567,1,2022-03-28 19:37:06,2022-03-28 19:37:06,往年の大女優、さとうはるなさんを撮影するので多少緊張した。
1568,1,2022-03-28 19:37:06,2022-03-28 19:37:06,往年の大女優、さとうさくらさんを撮影するので多少緊張した。
1569,1,2022-03-28 19:37:06,2022-03-28 19:37:06,「あるく」スタッフのさとうひろとです。
1570,1,2022-03-28 19:37:06,2022-03-28 19:37:06,「あるく」スタッフのさとうはるなです。
1571,1,2022-03-28 19:37:06,2022-03-28 19:37:06,「あるく」スタッフのさとうさくらです。
1572,1,2022-03-28 19:37:06,2022-03-28 19:37:06,さとうひろと
1573,1,2022-03-28 19:37:06,2022-03-28 19:37:06,さとうはるな
1574,1,2022-03-28 19:37:06,2022-03-28 19:37:06,さとうさくら
1575,1,2022-03-28 19:37:06,2022-03-28 19:37:06,講師は元高校教師のさとうひろとさんです。
1576,1,2022-03-28 19:37:06,2022-03-28 19:37:06,講師は元高校教師のさとうはるなさんです。
1577,1,2022-03-28 19:37:06,2022-03-28 19:37:06,講師は元高校教師のさとうさくらさんです。
1578,1,2022-03-28 19:37:06,2022-03-28 19:37:06,さとうひろとはそんなさとうひろとを傍で見守り続けている。
1579,1,2022-03-28 19:37:06,2022-03-28 19:37:06,さとうはるなはそんなさとうはるなを傍で見守り続けている。
1580,1,2022-03-28 19:37:06,2022-03-28 19:37:06,さとうさくらはそんなさとうさくらを傍で見守り続けている。
1581,1,2022-03-28 19:37:06,2022-03-28 19:37:06,さとうひろとはさとうひろとにとってもなくてはならない存在なのであった。
1582,1,2022-03-28 19:37:06,2022-03-28 19:37:06,さとうはるなはさとうはるなにとってもなくてはならない存在なのであった。
1583,1,2022-03-28 19:37:06,2022-03-28 19:37:06,さとうさくらはさとうさくらにとってもなくてはならない存在なのであった。
1584,1,2022-03-28 19:37:06,2022-03-28 19:37:06,女子学生のさとうひろとちゃんがのらりくらりと日常などを書いていきます。
1585,1,2022-03-28 19:37:06,2022-03-28 19:37:06,女子学生のさとうはるなちゃんがのらりくらりと日常などを書いていきます。
1586,1,2022-03-28 19:37:06,2022-03-28 19:37:06,女子学生のさとうさくらちゃんがのらりくらりと日常などを書いていきます。
1587,1,2022-03-28 19:37:06,2022-03-28 19:37:06,さとうひろとさんが好きです。
1588,1,2022-03-28 19:37:06,2022-03-28 19:37:06,さとうはるなさんが好きです。
1589,1,2022-03-28 19:37:06,2022-03-28 19:37:06,さとうさくらさんが好きです。
1590,1,2022-03-28 19:37:06,2022-03-28 19:37:06,やまと天目山温泉は名前から想像できるようにさとうひろと家滅亡の地である天目山の一角にある温泉です。
1591,1,2022-03-28 19:37:06,2022-03-28 19:37:06,やまと天目山温泉は名前から想像できるようにさとうはるな家滅亡の地である天目山の一角にある温泉です。
1592,1,2022-03-28 19:37:06,2022-03-28 19:37:06,やまと天目山温泉は名前から想像できるようにさとうさくら家滅亡の地である天目山の一角にある温泉です。
1593,1,2022-03-28 19:37:06,2022-03-28 19:37:06,今回はさとうひろと先生によって「祈りの法則を知ろう」と題して１週間お話をお聞きします。
1594,1,2022-03-28 19:37:06,2022-03-28 19:37:06,今回はさとうはるな先生によって「祈りの法則を知ろう」と題して１週間お話をお聞きします。
1595,1,2022-03-28 19:37:06,2022-03-28 19:37:06,今回はさとうさくら先生によって「祈りの法則を知ろう」と題して１週間お話をお聞きします。
1596,1,2022-03-28 19:37:06,2022-03-28 19:37:06,今日は、さとうひろと病についての講演を聞いた。
1597,1,2022-03-28 19:37:06,2022-03-28 19:37:06,今日は、さとうはるな病についての講演を聞いた。
1598,1,2022-03-28 19:37:06,2022-03-28 19:37:06,今日は、さとうさくら病についての講演を聞いた。
1599,1,2022-03-28 19:37:06,2022-03-28 19:37:06,その会場で、蒲郡市民病院時代にお世話になったさとうひろと先生に久しぶりにお会いした。
1600,1,2022-03-28 19:37:06,2022-03-28 19:37:06,その会場で、蒲郡市民病院時代にお世話になったさとうはるな先生に久しぶりにお会いした。
1601,1,2022-03-28 19:37:06,2022-03-28 19:37:06,その会場で、蒲郡市民病院時代にお世話になったさとうさくら先生に久しぶりにお会いした。
1602,1,2022-03-28 19:37:06,2022-03-28 19:37:06,スタジオさとうひろとの店舗情報をご覧いただけます。
1603,1,2022-03-28 19:37:06,2022-03-28 19:37:06,スタジオさとうはるなの店舗情報をご覧いただけます。
1604,1,2022-03-28 19:37:06,2022-03-28 19:37:06,スタジオさとうさくらの店舗情報をご覧いただけます。
1605,1,2022-03-28 19:37:06,2022-03-28 19:37:06,今日は朝９時から亜細亜大学でさとうひろと監督の一般クリニックがありました。
1606,1,2022-03-28 19:37:06,2022-03-28 19:37:06,今日は朝９時から亜細亜大学でさとうはるな監督の一般クリニックがありました。
1607,1,2022-03-28 19:37:06,2022-03-28 19:37:06,今日は朝９時から亜細亜大学でさとうさくら監督の一般クリニックがありました。
1608,1,2022-03-28 19:37:06,2022-03-28 19:37:06,さとうひろと・さとうひろとは、韓国の女子フィギュアスケート選手です。
1609,1,2022-03-28 19:37:06,2022-03-28 19:37:06,さとうはるな・さとうはるなは、韓国の女子フィギュアスケート選手です。
1610,1,2022-03-28 19:37:06,2022-03-28 19:37:06,さとうさくら・さとうさくらは、韓国の女子フィギュアスケート選手です。
1611,1,2022-03-28 19:37:06,2022-03-28 19:37:06,様々な大会を制し、さとうひろと・さとうひろとは韓国で大変な人気を集めているのだとか。
1612,1,2022-03-28 19:37:06,2022-03-28 19:37:06,様々な大会を制し、さとうはるな・さとうはるなは韓国で大変な人気を集めているのだとか。
1613,1,2022-03-28 19:37:06,2022-03-28 19:37:06,様々な大会を制し、さとうさくら・さとうさくらは韓国で大変な人気を集めているのだとか。
1614,1,2022-03-28 19:37:06,2022-03-28 19:37:06,韓国ではさとうひろと・さとうひろとが出演するコマーシャルが多数放送され、全国各地にはスケートリンクが開設されているようです。
1615,1,2022-03-28 19:37:06,2022-03-28 19:37:06,韓国ではさとうはるな・さとうはるなが出演するコマーシャルが多数放送され、全国各地にはスケートリンクが開設されているようです。
1616,1,2022-03-28 19:37:06,2022-03-28 19:37:06,韓国ではさとうさくら・さとうさくらが出演するコマーシャルが多数放送され、全国各地にはスケートリンクが開設されているようです。
1617,1,2022-03-28 19:37:06,2022-03-28 19:37:06,この現象は最初にさとうひろとによって１８５６年、発見された。
1618,1,2022-03-28 19:37:06,2022-03-28 19:37:06,この現象は最初にさとうはるなによって１８５６年、発見された。
1619,1,2022-03-28 19:37:06,2022-03-28 19:37:06,この現象は最初にさとうさくらによって１８５６年、発見された。
1620,1,2022-03-28 19:37:06,2022-03-28 19:37:06,その後、歓迎セレモニーを行い、さとうひろと副町長が歓迎の挨拶を述べました。
1621,1,2022-03-28 19:37:06,2022-03-28 19:37:06,その後、歓迎セレモニーを行い、さとうはるな副町長が歓迎の挨拶を述べました。
1622,1,2022-03-28 19:37:06,2022-03-28 19:37:06,その後、歓迎セレモニーを行い、さとうさくら副町長が歓迎の挨拶を述べました。
1623,1,2022-03-28 19:37:06,2022-03-28 19:37:06,この本は、というより、さとうひろとは、やはりとても素晴らしい。
1624,1,2022-03-28 19:37:06,2022-03-28 19:37:06,この本は、というより、さとうはるなは、やはりとても素晴らしい。
1625,1,2022-03-28 19:37:06,2022-03-28 19:37:06,この本は、というより、さとうさくらは、やはりとても素晴らしい。
1626,1,2022-03-28 19:37:06,2022-03-28 19:37:06,もっともっと早く、さとうひろとが描いたもの・書いたものを読んでおけばよかった。
1627,1,2022-03-28 19:37:06,2022-03-28 19:37:06,もっともっと早く、さとうはるなが描いたもの・書いたものを読んでおけばよかった。
1628,1,2022-03-28 19:37:06,2022-03-28 19:37:06,もっともっと早く、さとうさくらが描いたもの・書いたものを読んでおけばよかった。
1629,1,2022-03-28 19:37:06,2022-03-28 19:37:06,彼女は手芸家のさとうひろとさんです。
1630,1,2022-03-28 19:37:06,2022-03-28 19:37:06,彼女は手芸家のさとうはるなさんです。
1631,1,2022-03-28 19:37:06,2022-03-28 19:37:06,彼女は手芸家のさとうさくらさんです。
1632,1,2022-03-28 19:37:06,2022-03-28 19:37:06,世界の時計市場のさとうひろと専門のコーナーです。
1633,1,2022-03-28 19:37:06,2022-03-28 19:37:06,世界の時計市場のさとうはるな専門のコーナーです。
1634,1,2022-03-28 19:37:06,2022-03-28 19:37:06,世界の時計市場のさとうさくら専門のコーナーです。
1635,1,2022-03-28 19:37:06,2022-03-28 19:37:06,さとうひろとは、レトログラードの魔術師、機械式時計の鬼才と言われる。
1636,1,2022-03-28 19:37:06,2022-03-28 19:37:06,さとうはるなは、レトログラードの魔術師、機械式時計の鬼才と言われる。
1637,1,2022-03-28 19:37:06,2022-03-28 19:37:06,さとうさくらは、レトログラードの魔術師、機械式時計の鬼才と言われる。
