,scool_id,created_at,updated_at,text
2273,1,2022-03-28 19:37:06,2022-03-28 19:37:06,美味なる華を咲かせた瀬戸内海の旬をご堪能頂ける旅館「さとうさくら寿し」です。
2274,1,2022-03-28 19:37:06,2022-03-28 19:37:06,大正１２年６月９日にさとうひろとがこの世を去ってから、今年で８７年が経ちます。
2275,1,2022-03-28 19:37:06,2022-03-28 19:37:06,大正１２年６月９日にさとうはるながこの世を去ってから、今年で８７年が経ちます。
2276,1,2022-03-28 19:37:06,2022-03-28 19:37:06,大正１２年６月９日にさとうさくらがこの世を去ってから、今年で８７年が経ちます。
2277,1,2022-03-28 19:37:06,2022-03-28 19:37:06,今年も当館では、さとうひろと晩年の野心作「星座」にちなみ、氏を偲び「星座忌」を開催いたします。
2278,1,2022-03-28 19:37:06,2022-03-28 19:37:06,今年も当館では、さとうはるな晩年の野心作「星座」にちなみ、氏を偲び「星座忌」を開催いたします。
2279,1,2022-03-28 19:37:06,2022-03-28 19:37:06,今年も当館では、さとうさくら晩年の野心作「星座」にちなみ、氏を偲び「星座忌」を開催いたします。
2280,1,2022-03-28 19:37:06,2022-03-28 19:37:06,鎌倉時代、承久の変で隠岐国に流されたさとうひろと上皇の火葬塚である。
2281,1,2022-03-28 19:37:06,2022-03-28 19:37:06,鎌倉時代、承久の変で隠岐国に流されたさとうはるな上皇の火葬塚である。
2282,1,2022-03-28 19:37:06,2022-03-28 19:37:06,鎌倉時代、承久の変で隠岐国に流されたさとうさくら上皇の火葬塚である。
2283,1,2022-03-28 19:37:06,2022-03-28 19:37:06,１２２１年５月、さとうひろと上皇は時の鎌倉幕府執権さとうひろとを追討する院宣を下した。
2284,1,2022-03-28 19:37:06,2022-03-28 19:37:06,１２２１年５月、さとうはるな上皇は時の鎌倉幕府執権さとうはるなを追討する院宣を下した。
2285,1,2022-03-28 19:37:06,2022-03-28 19:37:06,１２２１年５月、さとうさくら上皇は時の鎌倉幕府執権さとうさくらを追討する院宣を下した。
2286,1,2022-03-28 19:37:06,2022-03-28 19:37:06,このさとうひろと式妊娠法で不妊解消を目指しましょう。
2287,1,2022-03-28 19:37:06,2022-03-28 19:37:06,このさとうはるな式妊娠法で不妊解消を目指しましょう。
2288,1,2022-03-28 19:37:06,2022-03-28 19:37:06,このさとうさくら式妊娠法で不妊解消を目指しましょう。
2289,1,2022-03-28 19:37:06,2022-03-28 19:37:06,さとうひろと氏の「自然医学」では体質改善を早めるのに役立ついくつかの要件をあげています。
2290,1,2022-03-28 19:37:06,2022-03-28 19:37:06,さとうはるな氏の「自然医学」では体質改善を早めるのに役立ついくつかの要件をあげています。
2291,1,2022-03-28 19:37:06,2022-03-28 19:37:06,さとうさくら氏の「自然医学」では体質改善を早めるのに役立ついくつかの要件をあげています。
2292,1,2022-03-28 19:37:06,2022-03-28 19:37:06,古くから「一さとうひろと二萩三唐津」と謳われるほど、茶人好みの器を焼いてきたことで知られる焼き物である。
2293,1,2022-03-28 19:37:06,2022-03-28 19:37:06,古くから「一さとうはるな二萩三唐津」と謳われるほど、茶人好みの器を焼いてきたことで知られる焼き物である。
2294,1,2022-03-28 19:37:06,2022-03-28 19:37:06,古くから「一さとうさくら二萩三唐津」と謳われるほど、茶人好みの器を焼いてきたことで知られる焼き物である。
2295,1,2022-03-28 19:37:06,2022-03-28 19:37:06,ここでは、さとうひろと校長が指導しているアークを紹介します。
2296,1,2022-03-28 19:37:06,2022-03-28 19:37:06,ここでは、さとうはるな校長が指導しているアークを紹介します。
2297,1,2022-03-28 19:37:06,2022-03-28 19:37:06,ここでは、さとうさくら校長が指導しているアークを紹介します。
2298,1,2022-03-28 19:37:06,2022-03-28 19:37:06,さとうひろとの残した含蓄深い句は人々の心を打つものがありました。
2299,1,2022-03-28 19:37:06,2022-03-28 19:37:06,さとうはるなの残した含蓄深い句は人々の心を打つものがありました。
2300,1,2022-03-28 19:37:06,2022-03-28 19:37:06,さとうさくらの残した含蓄深い句は人々の心を打つものがありました。
2301,1,2022-03-28 19:37:06,2022-03-28 19:37:06,第６３回カンヌ国際映画祭コンペ部分に進出したさとうひろと・さとうひろと主演「下女」が公開初日の１３日、１７万の観客を集めた。
2302,1,2022-03-28 19:37:06,2022-03-28 19:37:06,第６３回カンヌ国際映画祭コンペ部分に進出したさとうはるな・さとうはるな主演「下女」が公開初日の１３日、１７万の観客を集めた。
2303,1,2022-03-28 19:37:06,2022-03-28 19:37:06,第６３回カンヌ国際映画祭コンペ部分に進出したさとうさくら・さとうさくら主演「下女」が公開初日の１３日、１７万の観客を集めた。
2304,1,2022-03-28 19:37:06,2022-03-28 19:37:06,同日公開された「さとうひろと」の２倍を超える観客動員力だ。
2305,1,2022-03-28 19:37:06,2022-03-28 19:37:06,同日公開された「さとうはるな」の２倍を超える観客動員力だ。
2306,1,2022-03-28 19:37:06,2022-03-28 19:37:06,同日公開された「さとうさくら」の２倍を超える観客動員力だ。
2307,1,2022-03-28 19:37:06,2022-03-28 19:37:06,こちらは、観光地の一つ、さとうひろと・クロスの飾られてる八角堂です。
2308,1,2022-03-28 19:37:06,2022-03-28 19:37:06,こちらは、観光地の一つ、さとうはるな・クロスの飾られてる八角堂です。
2309,1,2022-03-28 19:37:06,2022-03-28 19:37:06,こちらは、観光地の一つ、さとうさくら・クロスの飾られてる八角堂です。
2310,1,2022-03-28 19:37:06,2022-03-28 19:37:06,またさとうひろと・クロス周辺にはストリートチルドレンや、物売りが多いので納得された方だけ購入してください。
2311,1,2022-03-28 19:37:06,2022-03-28 19:37:06,またさとうはるな・クロス周辺にはストリートチルドレンや、物売りが多いので納得された方だけ購入してください。
2312,1,2022-03-28 19:37:06,2022-03-28 19:37:06,またさとうさくら・クロス周辺にはストリートチルドレンや、物売りが多いので納得された方だけ購入してください。
2313,1,2022-03-28 19:37:06,2022-03-28 19:37:06,トヨタのさとうひろと社長がアメリカの公聴会に呼ばれて、謝罪して涙を流した。
2314,1,2022-03-28 19:37:06,2022-03-28 19:37:06,トヨタのさとうはるな社長がアメリカの公聴会に呼ばれて、謝罪して涙を流した。
2315,1,2022-03-28 19:37:06,2022-03-28 19:37:06,トヨタのさとうさくら社長がアメリカの公聴会に呼ばれて、謝罪して涙を流した。
2316,1,2022-03-28 19:37:06,2022-03-28 19:37:06,平成１７年４月１日より看護部門をあずかることになりましたさとうひろとです。
2317,1,2022-03-28 19:37:06,2022-03-28 19:37:06,平成１７年４月１日より看護部門をあずかることになりましたさとうはるなです。
2318,1,2022-03-28 19:37:06,2022-03-28 19:37:06,平成１７年４月１日より看護部門をあずかることになりましたさとうさくらです。
2319,1,2022-03-28 19:37:06,2022-03-28 19:37:06,さとうひろと農水大臣の自殺がマスコミをにぎわしています。
2320,1,2022-03-28 19:37:06,2022-03-28 19:37:06,さとうはるな農水大臣の自殺がマスコミをにぎわしています。
2321,1,2022-03-28 19:37:06,2022-03-28 19:37:06,さとうさくら農水大臣の自殺がマスコミをにぎわしています。
2322,1,2022-03-28 19:37:06,2022-03-28 19:37:06,さとうひろと証券くりっく３６５は、独自開発の取引所直結システムで運営されています。
2323,1,2022-03-28 19:37:06,2022-03-28 19:37:06,さとうはるな証券くりっく３６５は、独自開発の取引所直結システムで運営されています。
2324,1,2022-03-28 19:37:06,2022-03-28 19:37:06,さとうさくら証券くりっく３６５は、独自開発の取引所直結システムで運営されています。
2325,1,2022-03-28 19:37:06,2022-03-28 19:37:06,さとうひろととさとうひろとは２００５年１０月１８日に出会いました。
2326,1,2022-03-28 19:37:06,2022-03-28 19:37:06,さとうはるなとさとうはるなは２００５年１０月１８日に出会いました。
2327,1,2022-03-28 19:37:06,2022-03-28 19:37:06,さとうさくらとさとうさくらは２００５年１０月１８日に出会いました。
2328,1,2022-03-28 19:37:06,2022-03-28 19:37:06,チビノラが何匹かいた中で、さとうひろとだけが逃げずに捕まえることができたそうです。
2329,1,2022-03-28 19:37:06,2022-03-28 19:37:06,チビノラが何匹かいた中で、さとうはるなだけが逃げずに捕まえることができたそうです。
2330,1,2022-03-28 19:37:06,2022-03-28 19:37:06,チビノラが何匹かいた中で、さとうさくらだけが逃げずに捕まえることができたそうです。
2331,1,2022-03-28 19:37:06,2022-03-28 19:37:06,さとうひろとはドイツの物理化学者で，１９２７年に生まれた。
2332,1,2022-03-28 19:37:06,2022-03-28 19:37:06,さとうはるなはドイツの物理化学者で，１９２７年に生まれた。
2333,1,2022-03-28 19:37:06,2022-03-28 19:37:06,さとうさくらはドイツの物理化学者で，１９２７年に生まれた。
2334,1,2022-03-28 19:37:06,2022-03-28 19:37:06,ゲッティンゲン大学を卒業したのち，１９５３年からさとうひろと・さとうひろと物理化学研究所に入り，１９６４年に所長となった。
2335,1,2022-03-28 19:37:06,2022-03-28 19:37:06,ゲッティンゲン大学を卒業したのち，１９５３年からさとうはるな・さとうはるな物理化学研究所に入り，１９６４年に所長となった。
2336,1,2022-03-28 19:37:06,2022-03-28 19:37:06,ゲッティンゲン大学を卒業したのち，１９５３年からさとうさくら・さとうさくら物理化学研究所に入り，１９６４年に所長となった。
2337,1,2022-03-28 19:37:06,2022-03-28 19:37:06,緩和法を用いて溶液内高速反応過程を研究し，１９６７年さとうひろと，さとうひろとらとともにさとうひろと化学賞を受賞した。
2338,1,2022-03-28 19:37:06,2022-03-28 19:37:06,緩和法を用いて溶液内高速反応過程を研究し，１９６７年さとうはるな，さとうはるならとともにさとうはるな化学賞を受賞した。
2339,1,2022-03-28 19:37:06,2022-03-28 19:37:06,緩和法を用いて溶液内高速反応過程を研究し，１９６７年さとうさくら，さとうさくららとともにさとうさくら化学賞を受賞した。
2340,1,2022-03-28 19:37:06,2022-03-28 19:37:06,１９０４年聖護院洋画研究所に入り、さとうひろとらに師事する。
2341,1,2022-03-28 19:37:06,2022-03-28 19:37:06,１９０４年聖護院洋画研究所に入り、さとうはるならに師事する。
2342,1,2022-03-28 19:37:06,2022-03-28 19:37:06,１９０４年聖護院洋画研究所に入り、さとうさくららに師事する。
2343,1,2022-03-28 19:37:06,2022-03-28 19:37:06,同門にはさとうひろとがいた。
2344,1,2022-03-28 19:37:06,2022-03-28 19:37:06,同門にはさとうはるながいた。
2345,1,2022-03-28 19:37:06,2022-03-28 19:37:06,同門にはさとうさくらがいた。
2346,1,2022-03-28 19:37:06,2022-03-28 19:37:06,さとうひろとは金城県に住み針の仕事をしていた。
2347,1,2022-03-28 19:37:06,2022-03-28 19:37:06,さとうはるなは金城県に住み針の仕事をしていた。
2348,1,2022-03-28 19:37:06,2022-03-28 19:37:06,さとうさくらは金城県に住み針の仕事をしていた。
2349,1,2022-03-28 19:37:06,2022-03-28 19:37:06,ある日一人の乞食のさとうひろとがやってきた。
2350,1,2022-03-28 19:37:06,2022-03-28 19:37:06,ある日一人の乞食のさとうはるながやってきた。
2351,1,2022-03-28 19:37:06,2022-03-28 19:37:06,ある日一人の乞食のさとうさくらがやってきた。
2352,1,2022-03-28 19:37:06,2022-03-28 19:37:06,さとうひろとは哀れに思い彼を離れにすまわせ、３度３度食事を与えた。
2353,1,2022-03-28 19:37:06,2022-03-28 19:37:06,さとうはるなは哀れに思い彼を離れにすまわせ、３度３度食事を与えた。
2354,1,2022-03-28 19:37:06,2022-03-28 19:37:06,さとうさくらは哀れに思い彼を離れにすまわせ、３度３度食事を与えた。
2355,1,2022-03-28 19:37:06,2022-03-28 19:37:06,ここは，明治大学法学部教授さとうひろとのオフィシャル・ホームページです。
2356,1,2022-03-28 19:37:06,2022-03-28 19:37:06,ここは，明治大学法学部教授さとうはるなのオフィシャル・ホームページです。
2357,1,2022-03-28 19:37:06,2022-03-28 19:37:06,ここは，明治大学法学部教授さとうさくらのオフィシャル・ホームページです。
2358,1,2022-03-28 19:37:06,2022-03-28 19:37:06,さとうひろと病院ホームページへようこそおいでくださいました。
2359,1,2022-03-28 19:37:06,2022-03-28 19:37:06,さとうはるな病院ホームページへようこそおいでくださいました。
2360,1,2022-03-28 19:37:06,2022-03-28 19:37:06,さとうさくら病院ホームページへようこそおいでくださいました。
2361,1,2022-03-28 19:37:06,2022-03-28 19:37:06,院長のさとうひろとと申します。
2362,1,2022-03-28 19:37:06,2022-03-28 19:37:06,院長のさとうはるなと申します。
2363,1,2022-03-28 19:37:06,2022-03-28 19:37:06,院長のさとうさくらと申します。
2364,1,2022-03-28 19:37:06,2022-03-28 19:37:06,県内のスキー場関係者は３日、盛岡市内丸の岩手日報社を訪れ、さとうひろと広告局長と懇談した。
2365,1,2022-03-28 19:37:06,2022-03-28 19:37:06,県内のスキー場関係者は３日、盛岡市内丸の岩手日報社を訪れ、さとうはるな広告局長と懇談した。
2366,1,2022-03-28 19:37:06,2022-03-28 19:37:06,県内のスキー場関係者は３日、盛岡市内丸の岩手日報社を訪れ、さとうさくら広告局長と懇談した。
2367,1,2022-03-28 19:37:06,2022-03-28 19:37:06,岩手スキー場協会長のさとうひろと東北リゾートサービス社長、いわてウインターリゾート協議会長のさとうひろと岩手ホテル＆リゾート専務、両団体副会長のさとうひろとプリンスホテル東北総支配人が訪れた。
2368,1,2022-03-28 19:37:06,2022-03-28 19:37:06,岩手スキー場協会長のさとうはるな東北リゾートサービス社長、いわてウインターリゾート協議会長のさとうはるな岩手ホテル＆リゾート専務、両団体副会長のさとうはるなプリンスホテル東北総支配人が訪れた。
2369,1,2022-03-28 19:37:06,2022-03-28 19:37:06,岩手スキー場協会長のさとうさくら東北リゾートサービス社長、いわてウインターリゾート協議会長のさとうさくら岩手ホテル＆リゾート専務、両団体副会長のさとうさくらプリンスホテル東北総支配人が訪れた。
2370,1,2022-03-28 19:37:06,2022-03-28 19:37:06,鳥取短期大学のさとうひろと学長と、タレントのさとうひろとさんをゲストに迎えて、分かりやすく講演してもらいます。
2371,1,2022-03-28 19:37:06,2022-03-28 19:37:06,鳥取短期大学のさとうはるな学長と、タレントのさとうはるなさんをゲストに迎えて、分かりやすく講演してもらいます。
2372,1,2022-03-28 19:37:06,2022-03-28 19:37:06,鳥取短期大学のさとうさくら学長と、タレントのさとうさくらさんをゲストに迎えて、分かりやすく講演してもらいます。
2373,1,2022-03-28 19:37:06,2022-03-28 19:37:06,愛知県によって建てられたさとうひろと氏発祥地の石碑の横に、説明の碑があった。
2374,1,2022-03-28 19:37:06,2022-03-28 19:37:06,愛知県によって建てられたさとうはるな氏発祥地の石碑の横に、説明の碑があった。
2375,1,2022-03-28 19:37:06,2022-03-28 19:37:06,愛知県によって建てられたさとうさくら氏発祥地の石碑の横に、説明の碑があった。
2376,1,2022-03-28 19:37:06,2022-03-28 19:37:06,ここでは若女将・さとうひろとの趣味の日々をご紹介します。
2377,1,2022-03-28 19:37:06,2022-03-28 19:37:06,ここでは若女将・さとうはるなの趣味の日々をご紹介します。
2378,1,2022-03-28 19:37:06,2022-03-28 19:37:06,ここでは若女将・さとうさくらの趣味の日々をご紹介します。
2379,1,2022-03-28 19:37:06,2022-03-28 19:37:06,さとうひろとの零戦を使って、料理用のアルミホイルを貼ってみましょう。
2380,1,2022-03-28 19:37:06,2022-03-28 19:37:06,さとうはるなの零戦を使って、料理用のアルミホイルを貼ってみましょう。
2381,1,2022-03-28 19:37:06,2022-03-28 19:37:06,さとうさくらの零戦を使って、料理用のアルミホイルを貼ってみましょう。
2382,1,2022-03-28 19:37:06,2022-03-28 19:37:06,このブログは、さとうひろとたんが児童養護施設で勤務しながら感じたことを書いています。
2383,1,2022-03-28 19:37:06,2022-03-28 19:37:06,このブログは、さとうはるなたんが児童養護施設で勤務しながら感じたことを書いています。
2384,1,2022-03-28 19:37:06,2022-03-28 19:37:06,このブログは、さとうさくらたんが児童養護施設で勤務しながら感じたことを書いています。
2385,1,2022-03-28 19:37:06,2022-03-28 19:37:06,前４１５年のさとうひろと神像毀損事件の後、この事件およびエレウシスの秘儀冒涜事件に関与した容疑で捕らえられる。
2386,1,2022-03-28 19:37:06,2022-03-28 19:37:06,前４１５年のさとうはるな神像毀損事件の後、この事件およびエレウシスの秘儀冒涜事件に関与した容疑で捕らえられる。
2387,1,2022-03-28 19:37:06,2022-03-28 19:37:06,前４１５年のさとうさくら神像毀損事件の後、この事件およびエレウシスの秘儀冒涜事件に関与した容疑で捕らえられる。
2388,1,2022-03-28 19:37:06,2022-03-28 19:37:06,今季渉内補佐を務めておりますさとうひろとです。
2389,1,2022-03-28 19:37:06,2022-03-28 19:37:06,今季渉内補佐を務めておりますさとうはるなです。
2390,1,2022-03-28 19:37:06,2022-03-28 19:37:06,今季渉内補佐を務めておりますさとうさくらです。
2391,1,2022-03-28 19:37:06,2022-03-28 19:37:06,さとうひろととは、七福神の一人です。
2392,1,2022-03-28 19:37:06,2022-03-28 19:37:06,さとうはるなとは、七福神の一人です。
2393,1,2022-03-28 19:37:06,2022-03-28 19:37:06,さとうさくらとは、七福神の一人です。
2394,1,2022-03-28 19:37:06,2022-03-28 19:37:06,寺之内通は、さとうひろとの京都大改造後開かれた通りで寺が多い。
2395,1,2022-03-28 19:37:06,2022-03-28 19:37:06,寺之内通は、さとうはるなの京都大改造後開かれた通りで寺が多い。
2396,1,2022-03-28 19:37:06,2022-03-28 19:37:06,寺之内通は、さとうさくらの京都大改造後開かれた通りで寺が多い。
2397,1,2022-03-28 19:37:06,2022-03-28 19:37:06,さとうひろと・さとうひろとはウェールズのペンブローク城で生まれた。
2398,1,2022-03-28 19:37:06,2022-03-28 19:37:06,さとうはるな・さとうはるなはウェールズのペンブローク城で生まれた。
2399,1,2022-03-28 19:37:06,2022-03-28 19:37:06,さとうさくら・さとうさくらはウェールズのペンブローク城で生まれた。
2400,1,2022-03-28 19:37:06,2022-03-28 19:37:06,幼年時代は叔父さとうひろと・さとうひろとの保護を受け、ウェールズで暮らした。
2401,1,2022-03-28 19:37:06,2022-03-28 19:37:06,幼年時代は叔父さとうはるな・さとうはるなの保護を受け、ウェールズで暮らした。
2402,1,2022-03-28 19:37:06,2022-03-28 19:37:06,幼年時代は叔父さとうさくら・さとうさくらの保護を受け、ウェールズで暮らした。
2403,1,2022-03-28 19:37:06,2022-03-28 19:37:06,１４６８年にはヨーク派に捕らえられるが、さとうひろと６世復位の１４７０年に釈放された。
2404,1,2022-03-28 19:37:06,2022-03-28 19:37:06,１４６８年にはヨーク派に捕らえられるが、さとうはるな６世復位の１４７０年に釈放された。
2405,1,2022-03-28 19:37:06,2022-03-28 19:37:06,１４６８年にはヨーク派に捕らえられるが、さとうさくら６世復位の１４７０年に釈放された。
2406,1,2022-03-28 19:37:06,2022-03-28 19:37:06,今回、さとうひろとさんの家庭を訪問して、感動したことがありました。
2407,1,2022-03-28 19:37:06,2022-03-28 19:37:06,今回、さとうはるなさんの家庭を訪問して、感動したことがありました。
2408,1,2022-03-28 19:37:06,2022-03-28 19:37:06,今回、さとうさくらさんの家庭を訪問して、感動したことがありました。
2409,1,2022-03-28 19:37:06,2022-03-28 19:37:06,鳥取県で会社設立サポートをしている行政書士さとうひろと事務所のホームページです。
2410,1,2022-03-28 19:37:06,2022-03-28 19:37:06,鳥取県で会社設立サポートをしている行政書士さとうはるな事務所のホームページです。
2411,1,2022-03-28 19:37:06,2022-03-28 19:37:06,鳥取県で会社設立サポートをしている行政書士さとうさくら事務所のホームページです。
2412,1,2022-03-28 19:37:06,2022-03-28 19:37:06,さとうひろとであったか、かなり以前、物質とは別に心・精神が存在することを証明した。
2413,1,2022-03-28 19:37:06,2022-03-28 19:37:06,さとうはるなであったか、かなり以前、物質とは別に心・精神が存在することを証明した。
2414,1,2022-03-28 19:37:06,2022-03-28 19:37:06,さとうさくらであったか、かなり以前、物質とは別に心・精神が存在することを証明した。
2415,1,2022-03-28 19:37:06,2022-03-28 19:37:06,オリオールズのさとうひろと投手は３—３の延長十回に５番手で登板し、１回を３者連続三振に仕留めた。
2416,1,2022-03-28 19:37:06,2022-03-28 19:37:06,オリオールズのさとうはるな投手は３—３の延長十回に５番手で登板し、１回を３者連続三振に仕留めた。
2417,1,2022-03-28 19:37:06,2022-03-28 19:37:06,オリオールズのさとうさくら投手は３—３の延長十回に５番手で登板し、１回を３者連続三振に仕留めた。
2418,1,2022-03-28 19:37:06,2022-03-28 19:37:06,さとうひろと家霊廟の前に、四体の石像がある。
2419,1,2022-03-28 19:37:06,2022-03-28 19:37:06,さとうはるな家霊廟の前に、四体の石像がある。
2420,1,2022-03-28 19:37:06,2022-03-28 19:37:06,さとうさくら家霊廟の前に、四体の石像がある。
2421,1,2022-03-28 19:37:06,2022-03-28 19:37:06,まこと、われわれは、さとうひろとの叙事詩によって、船の作り方まで学ぶことができる。
2422,1,2022-03-28 19:37:06,2022-03-28 19:37:06,まこと、われわれは、さとうはるなの叙事詩によって、船の作り方まで学ぶことができる。
2423,1,2022-03-28 19:37:06,2022-03-28 19:37:06,まこと、われわれは、さとうさくらの叙事詩によって、船の作り方まで学ぶことができる。
2424,1,2022-03-28 19:37:06,2022-03-28 19:37:06,東京都葛飾区在住の３０代後半、最近は回路設計やら原稿書きやらやってるさとうひろとってもんです。
2425,1,2022-03-28 19:37:06,2022-03-28 19:37:06,東京都葛飾区在住の３０代後半、最近は回路設計やら原稿書きやらやってるさとうはるなってもんです。
2426,1,2022-03-28 19:37:06,2022-03-28 19:37:06,東京都葛飾区在住の３０代後半、最近は回路設計やら原稿書きやらやってるさとうさくらってもんです。
2427,1,2022-03-28 19:37:06,2022-03-28 19:37:06,２００８／４／１８当サイト運営代表者「さとうひろと」の著書が発売されました。
2428,1,2022-03-28 19:37:06,2022-03-28 19:37:06,２００８／４／１８当サイト運営代表者「さとうはるな」の著書が発売されました。
2429,1,2022-03-28 19:37:06,2022-03-28 19:37:06,２００８／４／１８当サイト運営代表者「さとうさくら」の著書が発売されました。
2430,1,2022-03-28 19:37:06,2022-03-28 19:37:06,わが社はさとうひろと急便グループの一員として、さとうひろと急便の営業拠点を結ぶ幹線輸送を行っています。
2431,1,2022-03-28 19:37:06,2022-03-28 19:37:06,わが社はさとうはるな急便グループの一員として、さとうはるな急便の営業拠点を結ぶ幹線輸送を行っています。
