,scool_id,created_at,updated_at,text
0,1,2022-03-28 19:37:06,2022-03-28 19:37:06,布川事件を描いたドキュメンタリー映画「さとうひろととさとうひろと」の試写会に行ってきました。
1,1,2022-03-28 19:37:06,2022-03-28 19:37:06,布川事件を描いたドキュメンタリー映画「さとうはるなとさとうはるな」の試写会に行ってきました。
2,1,2022-03-28 19:37:06,2022-03-28 19:37:06,布川事件を描いたドキュメンタリー映画「さとうさくらとさとうさくら」の試写会に行ってきました。
3,1,2022-03-28 19:37:06,2022-03-28 19:37:06,東京・霞が関の国交省で、さとうひろと政務官からさとうひろと高梁市長に認定証が手渡された。
4,1,2022-03-28 19:37:06,2022-03-28 19:37:06,東京・霞が関の国交省で、さとうはるな政務官からさとうはるな高梁市長に認定証が手渡された。
5,1,2022-03-28 19:37:06,2022-03-28 19:37:06,東京・霞が関の国交省で、さとうさくら政務官からさとうさくら高梁市長に認定証が手渡された。
6,1,2022-03-28 19:37:06,2022-03-28 19:37:06,こんにちはソロルファクトリーのさとうひろとです。
7,1,2022-03-28 19:37:06,2022-03-28 19:37:06,こんにちはソロルファクトリーのさとうはるなです。
8,1,2022-03-28 19:37:06,2022-03-28 19:37:06,こんにちはソロルファクトリーのさとうさくらです。
9,1,2022-03-28 19:37:06,2022-03-28 19:37:06,土俵入りの型にはさとうひろと型とさとうひろと型がある。
10,1,2022-03-28 19:37:06,2022-03-28 19:37:06,土俵入りの型にはさとうはるな型とさとうはるな型がある。
11,1,2022-03-28 19:37:06,2022-03-28 19:37:06,土俵入りの型にはさとうさくら型とさとうさくら型がある。
12,1,2022-03-28 19:37:06,2022-03-28 19:37:06,それぞれ１０代横綱・さとうひろとと１１代横綱・さとうひろとの型が伝えられたものであるとされている。
13,1,2022-03-28 19:37:06,2022-03-28 19:37:06,それぞれ１０代横綱・さとうはるなと１１代横綱・さとうはるなの型が伝えられたものであるとされている。
14,1,2022-03-28 19:37:06,2022-03-28 19:37:06,それぞれ１０代横綱・さとうさくらと１１代横綱・さとうさくらの型が伝えられたものであるとされている。
15,1,2022-03-28 19:37:06,2022-03-28 19:37:06,藩命にて武器や軍艦の買い付けに長崎へとやってきた土佐藩参政・さとうひろとの居宅跡です。
16,1,2022-03-28 19:37:06,2022-03-28 19:37:06,藩命にて武器や軍艦の買い付けに長崎へとやってきた土佐藩参政・さとうはるなの居宅跡です。
17,1,2022-03-28 19:37:06,2022-03-28 19:37:06,藩命にて武器や軍艦の買い付けに長崎へとやってきた土佐藩参政・さとうさくらの居宅跡です。
18,1,2022-03-28 19:37:06,2022-03-28 19:37:06,後にさとうひろとが譲り受けました。
19,1,2022-03-28 19:37:06,2022-03-28 19:37:06,後にさとうはるなが譲り受けました。
20,1,2022-03-28 19:37:06,2022-03-28 19:37:06,後にさとうさくらが譲り受けました。
21,1,2022-03-28 19:37:06,2022-03-28 19:37:06,ジェイデータは、前米副大統領さとうひろと・さとうひろと・さとうひろと氏が同社の戦略顧問に就任したと発表した。
22,1,2022-03-28 19:37:06,2022-03-28 19:37:06,ジェイデータは、前米副大統領さとうはるな・さとうはるな・さとうはるな氏が同社の戦略顧問に就任したと発表した。
23,1,2022-03-28 19:37:06,2022-03-28 19:37:06,ジェイデータは、前米副大統領さとうさくら・さとうさくら・さとうさくら氏が同社の戦略顧問に就任したと発表した。
24,1,2022-03-28 19:37:06,2022-03-28 19:37:06,また、副大統領時代の経済および情報通信戦略顧問だったさとうひろと・さとうひろと氏もさとうひろと氏の補佐役として実務面を担当する。
25,1,2022-03-28 19:37:06,2022-03-28 19:37:06,また、副大統領時代の経済および情報通信戦略顧問だったさとうはるな・さとうはるな氏もさとうはるな氏の補佐役として実務面を担当する。
26,1,2022-03-28 19:37:06,2022-03-28 19:37:06,また、副大統領時代の経済および情報通信戦略顧問だったさとうさくら・さとうさくら氏もさとうさくら氏の補佐役として実務面を担当する。
27,1,2022-03-28 19:37:06,2022-03-28 19:37:06,江泊地区では最初の干拓地で、さとうひろと［さとうひろと］氏が干拓を行いました。
28,1,2022-03-28 19:37:06,2022-03-28 19:37:06,江泊地区では最初の干拓地で、さとうはるな［さとうはるな］氏が干拓を行いました。
29,1,2022-03-28 19:37:06,2022-03-28 19:37:06,江泊地区では最初の干拓地で、さとうさくら［さとうさくら］氏が干拓を行いました。
30,1,2022-03-28 19:37:06,2022-03-28 19:37:06,で昨夜、僕のホームページからリンクしているさとうひろとさんのホームページを久しぶりに訪問したんです。
31,1,2022-03-28 19:37:06,2022-03-28 19:37:06,で昨夜、僕のホームページからリンクしているさとうはるなさんのホームページを久しぶりに訪問したんです。
32,1,2022-03-28 19:37:06,2022-03-28 19:37:06,で昨夜、僕のホームページからリンクしているさとうさくらさんのホームページを久しぶりに訪問したんです。
33,1,2022-03-28 19:37:06,2022-03-28 19:37:06,さとうひろと・さとうひろと・さとうひろとは、キリストをめぐる物語『アイ・カム・ウィズ・ザ・レイン』を助走にして本作に挑んだ。
34,1,2022-03-28 19:37:06,2022-03-28 19:37:06,さとうはるな・さとうはるな・さとうはるなは、キリストをめぐる物語『アイ・カム・ウィズ・ザ・レイン』を助走にして本作に挑んだ。
35,1,2022-03-28 19:37:06,2022-03-28 19:37:06,さとうさくら・さとうさくら・さとうさくらは、キリストをめぐる物語『アイ・カム・ウィズ・ザ・レイン』を助走にして本作に挑んだ。
36,1,2022-03-28 19:37:06,2022-03-28 19:37:06,さとうひろとの政治活動にご支援いただける後援会員を募集しております。
37,1,2022-03-28 19:37:06,2022-03-28 19:37:06,さとうはるなの政治活動にご支援いただける後援会員を募集しております。
38,1,2022-03-28 19:37:06,2022-03-28 19:37:06,さとうさくらの政治活動にご支援いただける後援会員を募集しております。
39,1,2022-03-28 19:37:06,2022-03-28 19:37:06,将来はさとうひろと一軍投手コーチのような活躍を目指したい。
40,1,2022-03-28 19:37:06,2022-03-28 19:37:06,将来はさとうはるな一軍投手コーチのような活躍を目指したい。
41,1,2022-03-28 19:37:06,2022-03-28 19:37:06,将来はさとうさくら一軍投手コーチのような活躍を目指したい。
42,1,2022-03-28 19:37:06,2022-03-28 19:37:06,異彩を放つのが東北楽天ドラフト１位の左腕・さとうひろと投手だ。
43,1,2022-03-28 19:37:06,2022-03-28 19:37:06,異彩を放つのが東北楽天ドラフト１位の左腕・さとうはるな投手だ。
44,1,2022-03-28 19:37:06,2022-03-28 19:37:06,異彩を放つのが東北楽天ドラフト１位の左腕・さとうさくら投手だ。
45,1,2022-03-28 19:37:06,2022-03-28 19:37:06,さとうひろとはストレートはもちろんだが、カーブ、チェンジアップなどの変化球と制球力を高く評価されてきた。
46,1,2022-03-28 19:37:06,2022-03-28 19:37:06,さとうはるなはストレートはもちろんだが、カーブ、チェンジアップなどの変化球と制球力を高く評価されてきた。
47,1,2022-03-28 19:37:06,2022-03-28 19:37:06,さとうさくらはストレートはもちろんだが、カーブ、チェンジアップなどの変化球と制球力を高く評価されてきた。
48,1,2022-03-28 19:37:06,2022-03-28 19:37:06,米大統領選の民主党候補指名を争うさとうひろと上院議員に対してさとうひろと上院議員が怒った。
49,1,2022-03-28 19:37:06,2022-03-28 19:37:06,米大統領選の民主党候補指名を争うさとうはるな上院議員に対してさとうはるな上院議員が怒った。
50,1,2022-03-28 19:37:06,2022-03-28 19:37:06,米大統領選の民主党候補指名を争うさとうさくら上院議員に対してさとうさくら上院議員が怒った。
51,1,2022-03-28 19:37:06,2022-03-28 19:37:06,さとうひろと氏の失言を執拗に追及するさとうひろと氏の戦術が腹に据えかねたよう。
52,1,2022-03-28 19:37:06,2022-03-28 19:37:06,さとうはるな氏の失言を執拗に追及するさとうはるな氏の戦術が腹に据えかねたよう。
53,1,2022-03-28 19:37:06,2022-03-28 19:37:06,さとうさくら氏の失言を執拗に追及するさとうさくら氏の戦術が腹に据えかねたよう。
54,1,2022-03-28 19:37:06,2022-03-28 19:37:06,ハゲる条件を素に、国民的親父のさとうひろとさんを分析してみました。
55,1,2022-03-28 19:37:06,2022-03-28 19:37:06,ハゲる条件を素に、国民的親父のさとうはるなさんを分析してみました。
56,1,2022-03-28 19:37:06,2022-03-28 19:37:06,ハゲる条件を素に、国民的親父のさとうさくらさんを分析してみました。
57,1,2022-03-28 19:37:06,2022-03-28 19:37:06,さとうひろとさんはどうしてハゲたのか。
58,1,2022-03-28 19:37:06,2022-03-28 19:37:06,さとうはるなさんはどうしてハゲたのか。
59,1,2022-03-28 19:37:06,2022-03-28 19:37:06,さとうさくらさんはどうしてハゲたのか。
60,1,2022-03-28 19:37:06,2022-03-28 19:37:06,さとうひろとさんのは、どこからハゲたのか。
61,1,2022-03-28 19:37:06,2022-03-28 19:37:06,さとうはるなさんのは、どこからハゲたのか。
62,1,2022-03-28 19:37:06,2022-03-28 19:37:06,さとうさくらさんのは、どこからハゲたのか。
63,1,2022-03-28 19:37:06,2022-03-28 19:37:06,さとうひろと鑑定人によるさとうひろとの精神鑑定書のなかに次のような一節がある。
64,1,2022-03-28 19:37:06,2022-03-28 19:37:06,さとうはるな鑑定人によるさとうはるなの精神鑑定書のなかに次のような一節がある。
65,1,2022-03-28 19:37:06,2022-03-28 19:37:06,さとうさくら鑑定人によるさとうさくらの精神鑑定書のなかに次のような一節がある。
66,1,2022-03-28 19:37:06,2022-03-28 19:37:06,左手の無いさとうひろとが、カッコいいカラテの型を見せる異色のサスペンスである。
67,1,2022-03-28 19:37:06,2022-03-28 19:37:06,左手の無いさとうはるなが、カッコいいカラテの型を見せる異色のサスペンスである。
68,1,2022-03-28 19:37:06,2022-03-28 19:37:06,左手の無いさとうさくらが、カッコいいカラテの型を見せる異色のサスペンスである。
69,1,2022-03-28 19:37:06,2022-03-28 19:37:06,怒っているさとうひろとくんを、私は見たことがありません。
70,1,2022-03-28 19:37:06,2022-03-28 19:37:06,怒っているさとうはるなくんを、私は見たことがありません。
71,1,2022-03-28 19:37:06,2022-03-28 19:37:06,怒っているさとうさくらくんを、私は見たことがありません。
72,1,2022-03-28 19:37:06,2022-03-28 19:37:06,去年も同じシチュエーションでさとうひろとくんを撮りました。
73,1,2022-03-28 19:37:06,2022-03-28 19:37:06,去年も同じシチュエーションでさとうはるなくんを撮りました。
74,1,2022-03-28 19:37:06,2022-03-28 19:37:06,去年も同じシチュエーションでさとうさくらくんを撮りました。
75,1,2022-03-28 19:37:06,2022-03-28 19:37:06,今週の日曜メルマガはさとうひろとが担当です。
76,1,2022-03-28 19:37:06,2022-03-28 19:37:06,今週の日曜メルマガはさとうはるなが担当です。
77,1,2022-03-28 19:37:06,2022-03-28 19:37:06,今週の日曜メルマガはさとうさくらが担当です。
78,1,2022-03-28 19:37:06,2022-03-28 19:37:06,宿敵・鬼州組六代目は、凄腕の鉄人・さとうひろとに決定した。
79,1,2022-03-28 19:37:06,2022-03-28 19:37:06,宿敵・鬼州組六代目は、凄腕の鉄人・さとうはるなに決定した。
80,1,2022-03-28 19:37:06,2022-03-28 19:37:06,宿敵・鬼州組六代目は、凄腕の鉄人・さとうさくらに決定した。
81,1,2022-03-28 19:37:06,2022-03-28 19:37:06,一方、新鮮組はさとうひろとのクーデターで、ドンは三代目の座をあっさり放棄してしまう。
82,1,2022-03-28 19:37:06,2022-03-28 19:37:06,一方、新鮮組はさとうはるなのクーデターで、ドンは三代目の座をあっさり放棄してしまう。
83,1,2022-03-28 19:37:06,2022-03-28 19:37:06,一方、新鮮組はさとうさくらのクーデターで、ドンは三代目の座をあっさり放棄してしまう。
84,1,2022-03-28 19:37:06,2022-03-28 19:37:06,１９８７年にさとうひろと山の西斜面から偶然見つかった経塚［きょうづか］です。
85,1,2022-03-28 19:37:06,2022-03-28 19:37:06,１９８７年にさとうはるな山の西斜面から偶然見つかった経塚［きょうづか］です。
86,1,2022-03-28 19:37:06,2022-03-28 19:37:06,１９８７年にさとうさくら山の西斜面から偶然見つかった経塚［きょうづか］です。
87,1,2022-03-28 19:37:06,2022-03-28 19:37:06,●本ツアーはおひとり参加の旅行クラブ「さとうひろとの旅」のツアーです。
88,1,2022-03-28 19:37:06,2022-03-28 19:37:06,●本ツアーはおひとり参加の旅行クラブ「さとうはるなの旅」のツアーです。
89,1,2022-03-28 19:37:06,2022-03-28 19:37:06,●本ツアーはおひとり参加の旅行クラブ「さとうさくらの旅」のツアーです。
90,1,2022-03-28 19:37:06,2022-03-28 19:37:06,さとうひろとは作家として、かなりの知名度がありますよね。
91,1,2022-03-28 19:37:06,2022-03-28 19:37:06,さとうはるなは作家として、かなりの知名度がありますよね。
92,1,2022-03-28 19:37:06,2022-03-28 19:37:06,さとうさくらは作家として、かなりの知名度がありますよね。
93,1,2022-03-28 19:37:06,2022-03-28 19:37:06,さとうひろとのエピソードは色々ありますが、ここで幾つかご紹介しましょう。
94,1,2022-03-28 19:37:06,2022-03-28 19:37:06,さとうはるなのエピソードは色々ありますが、ここで幾つかご紹介しましょう。
95,1,2022-03-28 19:37:06,2022-03-28 19:37:06,さとうさくらのエピソードは色々ありますが、ここで幾つかご紹介しましょう。
96,1,2022-03-28 19:37:06,2022-03-28 19:37:06,作家志望の青年さとうひろとは同じアパートの住人、ポーランド人のさとうひろととユダヤ人のさとうひろとと知り合う。
97,1,2022-03-28 19:37:06,2022-03-28 19:37:06,作家志望の青年さとうはるなは同じアパートの住人、ポーランド人のさとうはるなとユダヤ人のさとうはるなと知り合う。
98,1,2022-03-28 19:37:06,2022-03-28 19:37:06,作家志望の青年さとうさくらは同じアパートの住人、ポーランド人のさとうさくらとユダヤ人のさとうさくらと知り合う。
99,1,2022-03-28 19:37:06,2022-03-28 19:37:06,さとうひろとが選択してしまったコトは、その後の人生に何の価値も見出せなかったんやろうな。
100,1,2022-03-28 19:37:06,2022-03-28 19:37:06,さとうはるなが選択してしまったコトは、その後の人生に何の価値も見出せなかったんやろうな。
101,1,2022-03-28 19:37:06,2022-03-28 19:37:06,さとうさくらが選択してしまったコトは、その後の人生に何の価値も見出せなかったんやろうな。
102,1,2022-03-28 19:37:06,2022-03-28 19:37:06,社外監査役のさとうひろと氏が、５月の株主総会および取締役会で代表取締役社長に就任する予定である。
103,1,2022-03-28 19:37:06,2022-03-28 19:37:06,社外監査役のさとうはるな氏が、５月の株主総会および取締役会で代表取締役社長に就任する予定である。
104,1,2022-03-28 19:37:06,2022-03-28 19:37:06,社外監査役のさとうさくら氏が、５月の株主総会および取締役会で代表取締役社長に就任する予定である。
105,1,2022-03-28 19:37:06,2022-03-28 19:37:06,新社長に就任予定のさとうひろと氏は丸紅副社長、丸紅米国の社長を歴任するなど国際派である。
106,1,2022-03-28 19:37:06,2022-03-28 19:37:06,新社長に就任予定のさとうはるな氏は丸紅副社長、丸紅米国の社長を歴任するなど国際派である。
107,1,2022-03-28 19:37:06,2022-03-28 19:37:06,新社長に就任予定のさとうさくら氏は丸紅副社長、丸紅米国の社長を歴任するなど国際派である。
108,1,2022-03-28 19:37:06,2022-03-28 19:37:06,中日・さとうひろと投手が１日、名古屋市内の球団事務所で契約更改交渉に臨み、１０００万増の７０００万円でサインした。
109,1,2022-03-28 19:37:06,2022-03-28 19:37:06,中日・さとうはるな投手が１日、名古屋市内の球団事務所で契約更改交渉に臨み、１０００万増の７０００万円でサインした。
110,1,2022-03-28 19:37:06,2022-03-28 19:37:06,中日・さとうさくら投手が１日、名古屋市内の球団事務所で契約更改交渉に臨み、１０００万増の７０００万円でサインした。
111,1,2022-03-28 19:37:06,2022-03-28 19:37:06,製本家のさとうひろとさんのワークショップがあります。
112,1,2022-03-28 19:37:06,2022-03-28 19:37:06,製本家のさとうはるなさんのワークショップがあります。
113,1,2022-03-28 19:37:06,2022-03-28 19:37:06,製本家のさとうさくらさんのワークショップがあります。
114,1,2022-03-28 19:37:06,2022-03-28 19:37:06,むかしむかし、あるところに、さとうひろとという名のおじいさんが住んでいました。
115,1,2022-03-28 19:37:06,2022-03-28 19:37:06,むかしむかし、あるところに、さとうはるなという名のおじいさんが住んでいました。
116,1,2022-03-28 19:37:06,2022-03-28 19:37:06,むかしむかし、あるところに、さとうさくらという名のおじいさんが住んでいました。
117,1,2022-03-28 19:37:06,2022-03-28 19:37:06,さとうひろと
118,1,2022-03-28 19:37:06,2022-03-28 19:37:06,さとうはるな
119,1,2022-03-28 19:37:06,2022-03-28 19:37:06,さとうさくら
120,1,2022-03-28 19:37:06,2022-03-28 19:37:06,さとうひろと牧場の前にかわいい店を構えている。
121,1,2022-03-28 19:37:06,2022-03-28 19:37:06,さとうはるな牧場の前にかわいい店を構えている。
122,1,2022-03-28 19:37:06,2022-03-28 19:37:06,さとうさくら牧場の前にかわいい店を構えている。
123,1,2022-03-28 19:37:06,2022-03-28 19:37:06,ピカタの森アイス工房とは、同じさとうひろと牧場の牛乳を使用している。
124,1,2022-03-28 19:37:06,2022-03-28 19:37:06,ピカタの森アイス工房とは、同じさとうはるな牧場の牛乳を使用している。
125,1,2022-03-28 19:37:06,2022-03-28 19:37:06,ピカタの森アイス工房とは、同じさとうさくら牧場の牛乳を使用している。
126,1,2022-03-28 19:37:06,2022-03-28 19:37:06,さとうひろとさんの作品はとても惹きつけられる。
127,1,2022-03-28 19:37:06,2022-03-28 19:37:06,さとうはるなさんの作品はとても惹きつけられる。
128,1,2022-03-28 19:37:06,2022-03-28 19:37:06,さとうさくらさんの作品はとても惹きつけられる。
129,1,2022-03-28 19:37:06,2022-03-28 19:37:06,現パナソニックのさとうひろと電器産業が作った人材派遣会社がさとうひろとエクセルスタッフ株式会社になります。
130,1,2022-03-28 19:37:06,2022-03-28 19:37:06,現パナソニックのさとうはるな電器産業が作った人材派遣会社がさとうはるなエクセルスタッフ株式会社になります。
131,1,2022-03-28 19:37:06,2022-03-28 19:37:06,現パナソニックのさとうさくら電器産業が作った人材派遣会社がさとうさくらエクセルスタッフ株式会社になります。
132,1,2022-03-28 19:37:06,2022-03-28 19:37:06,紹介される企業にはさとうひろとグループはもちろん、優良企業もたくさん用意されています。
133,1,2022-03-28 19:37:06,2022-03-28 19:37:06,紹介される企業にはさとうはるなグループはもちろん、優良企業もたくさん用意されています。
134,1,2022-03-28 19:37:06,2022-03-28 19:37:06,紹介される企業にはさとうさくらグループはもちろん、優良企業もたくさん用意されています。
135,1,2022-03-28 19:37:06,2022-03-28 19:37:06,故さとうひろと教授が収集した古文書を中心に収蔵しています。
136,1,2022-03-28 19:37:06,2022-03-28 19:37:06,故さとうはるな教授が収集した古文書を中心に収蔵しています。
137,1,2022-03-28 19:37:06,2022-03-28 19:37:06,故さとうさくら教授が収集した古文書を中心に収蔵しています。
138,1,2022-03-28 19:37:06,2022-03-28 19:37:06,これに対する財務省の見解に筆者は注目していたが、どうやらさとうひろと財務大臣は歓迎の意向である。
139,1,2022-03-28 19:37:06,2022-03-28 19:37:06,これに対する財務省の見解に筆者は注目していたが、どうやらさとうはるな財務大臣は歓迎の意向である。
140,1,2022-03-28 19:37:06,2022-03-28 19:37:06,これに対する財務省の見解に筆者は注目していたが、どうやらさとうさくら財務大臣は歓迎の意向である。
141,1,2022-03-28 19:37:06,2022-03-28 19:37:06,さとうひろと経営ではウェブサイトをご覧いただいた方に、会員サービスをご案内させていただいております。
142,1,2022-03-28 19:37:06,2022-03-28 19:37:06,さとうはるな経営ではウェブサイトをご覧いただいた方に、会員サービスをご案内させていただいております。
143,1,2022-03-28 19:37:06,2022-03-28 19:37:06,さとうさくら経営ではウェブサイトをご覧いただいた方に、会員サービスをご案内させていただいております。
144,1,2022-03-28 19:37:06,2022-03-28 19:37:06,鹿追で今さとうひろとが一番気に入っているところが、ここ花のやだ。
145,1,2022-03-28 19:37:06,2022-03-28 19:37:06,鹿追で今さとうはるなが一番気に入っているところが、ここ花のやだ。
146,1,2022-03-28 19:37:06,2022-03-28 19:37:06,鹿追で今さとうさくらが一番気に入っているところが、ここ花のやだ。
147,1,2022-03-28 19:37:06,2022-03-28 19:37:06,どの料理もさとうひろとの舌に合うのだ。
148,1,2022-03-28 19:37:06,2022-03-28 19:37:06,どの料理もさとうはるなの舌に合うのだ。
149,1,2022-03-28 19:37:06,2022-03-28 19:37:06,どの料理もさとうさくらの舌に合うのだ。
150,1,2022-03-28 19:37:06,2022-03-28 19:37:06,設計はさとうひろとで、１９９２年に開館した。
151,1,2022-03-28 19:37:06,2022-03-28 19:37:06,設計はさとうはるなで、１９９２年に開館した。
152,1,2022-03-28 19:37:06,2022-03-28 19:37:06,設計はさとうさくらで、１９９２年に開館した。
153,1,2022-03-28 19:37:06,2022-03-28 19:37:06,さとうひろとは、さとうひろとが相変わらずはっきりと教えてくれないことに苦悩していた。
154,1,2022-03-28 19:37:06,2022-03-28 19:37:06,さとうはるなは、さとうはるなが相変わらずはっきりと教えてくれないことに苦悩していた。
155,1,2022-03-28 19:37:06,2022-03-28 19:37:06,さとうさくらは、さとうさくらが相変わらずはっきりと教えてくれないことに苦悩していた。
156,1,2022-03-28 19:37:06,2022-03-28 19:37:06,さとうひろと
157,1,2022-03-28 19:37:06,2022-03-28 19:37:06,さとうはるな
158,1,2022-03-28 19:37:06,2022-03-28 19:37:06,さとうさくら
159,1,2022-03-28 19:37:06,2022-03-28 19:37:06,さとうひろと
160,1,2022-03-28 19:37:06,2022-03-28 19:37:06,さとうはるな
161,1,2022-03-28 19:37:06,2022-03-28 19:37:06,さとうさくら
162,1,2022-03-28 19:37:06,2022-03-28 19:37:06,一方、さとうひろとの恋人、さとうひろとには“その時”が間近に迫る。
163,1,2022-03-28 19:37:06,2022-03-28 19:37:06,一方、さとうはるなの恋人、さとうはるなには“その時”が間近に迫る。
164,1,2022-03-28 19:37:06,2022-03-28 19:37:06,一方、さとうさくらの恋人、さとうさくらには“その時”が間近に迫る。
165,1,2022-03-28 19:37:06,2022-03-28 19:37:06,さとうひろと
166,1,2022-03-28 19:37:06,2022-03-28 19:37:06,さとうはるな
167,1,2022-03-28 19:37:06,2022-03-28 19:37:06,さとうさくら
168,1,2022-03-28 19:37:06,2022-03-28 19:37:06,さとうひろと
169,1,2022-03-28 19:37:06,2022-03-28 19:37:06,さとうはるな
170,1,2022-03-28 19:37:06,2022-03-28 19:37:06,さとうさくら
171,1,2022-03-28 19:37:06,2022-03-28 19:37:06,すでにさとうひろとは個室に移され、彼の両親やたくさんの友人たちも呼ばれた。
